Tweet,Etiket,Alt Etiket,CONTEXT_INPUT
iyi partili türkkan 1.5 milyon suriyeli daha gelecek!,2,,iyi partili türkkan 1.5 milyon suriyeli daha gelecek!
"başkan erdoğan'dan suriyeli mülteci mesajı! ""ya destek verin ya da kapıları açarız""",2,,"iyi partili türkkan 1.5 milyon suriyeli daha gelecek! [SEP] başkan erdoğan'dan suriyeli mülteci mesajı! ""ya destek verin ya da kapıları açarız"""
"arslan bulut yazdı ""300 metrekarelik konaklar yaptıralım suriyelilere…"" akp iktidarı istanbul'un ve güneydoğu şehirlerinin demografik yapısını değiştirdi! suriyeli çalıştıranlara teşvik bile veriyorlar! türk çalıştırırsan teşvik yok!",1,etnik,"başkan erdoğan'dan suriyeli mülteci mesajı! ""ya destek verin ya da kapıları açarız"" [SEP] arslan bulut yazdı ""300 metrekarelik konaklar yaptıralım suriyelilere…"" akp iktidarı istanbul'un ve güneydoğu şehirlerinin demografik yapısını değiştirdi! suriyeli çalıştıranlara teşvik bile veriyorlar! türk çalıştırırsan teşvik yok!"
güzel bir amaçla yola çıkmış ama insan askerini polisini bu denli kötüler mi? özellikle doğuda ve sınırda ne şartlar altında çalışıyor bu insanlar biraz insaf edin. bir de faşizmi eleştirip savaştan kaçıp gelen suriyeli insanlara gönderme yapmışlar. kusura bakmayın ama bu kaypakça,2,,"arslan bulut yazdı ""300 metrekarelik konaklar yaptıralım suriyelilere…"" akp iktidarı istanbul'un ve güneydoğu şehirlerinin demografik yapısını değiştirdi! suriyeli çalıştıranlara teşvik bile veriyorlar! türk çalıştırırsan teşvik yok! [SEP] güzel bir amaçla yola çıkmış ama insan askerini polisini bu denli kötüler mi? özellikle doğuda ve sınırda ne şartlar altında çalışıyor bu insanlar biraz insaf edin. bir de faşizmi eleştirip savaştan kaçıp gelen suriyeli insanlara gönderme yapmışlar. kusura bakmayın ama bu kaypakça"
kimin parası bu türk halkının parası peki bizim bu kadar suriyeli baktığımız yetmediği gibi bir de bahçeli ev mi yapacağız? türkiye tapusunu da verelim mi suriyelilere... hani şu yakaladığında arkadan vuran suriyelilere... besle kargayı oysun gözünü yapan suriyelilere...,1,etnik,güzel bir amaçla yola çıkmış ama insan askerini polisini bu denli kötüler mi? özellikle doğuda ve sınırda ne şartlar altında çalışıyor bu insanlar biraz insaf edin. bir de faşizmi eleştirip savaştan kaçıp gelen suriyeli insanlara gönderme yapmışlar. kusura bakmayın ama bu kaypakça [SEP] kimin parası bu türk halkının parası peki bizim bu kadar suriyeli baktığımız yetmediği gibi bir de bahçeli ev mi yapacağız? türkiye tapusunu da verelim mi suriyelilere... hani şu yakaladığında arkadan vuran suriyelilere... besle kargayı oysun gözünü yapan suriyelilere...
galatasaraylı taraftarlara suriyeli diyenler dönüp önce kendine baksın!...,1,etnik,kimin parası bu türk halkının parası peki bizim bu kadar suriyeli baktığımız yetmediği gibi bir de bahçeli ev mi yapacağız? türkiye tapusunu da verelim mi suriyelilere... hani şu yakaladığında arkadan vuran suriyelilere... besle kargayı oysun gözünü yapan suriyelilere... [SEP] galatasaraylı taraftarlara suriyeli diyenler dönüp önce kendine baksın!...
açlıktan nefesimiz kokuyor tavuk dürüm yemekten gına geldi başkan çıkmış suriyeli vatan hainlerine 150 m2 bahçeli ev yapalım diyor asgari ücret 2020 tl başkan halk perişan ağalık yapma zamanı mı şimdi.,1,etnik,galatasaraylı taraftarlara suriyeli diyenler dönüp önce kendine baksın!... [SEP] açlıktan nefesimiz kokuyor tavuk dürüm yemekten gına geldi başkan çıkmış suriyeli vatan hainlerine 150 m2 bahçeli ev yapalım diyor asgari ücret 2020 tl başkan halk perişan ağalık yapma zamanı mı şimdi.
diyarbakırlı analar eksik suriyeli çocuklar eksik o eksik bu eksik onu da sen yap bişeyler de sen doldur kardeşim.,2,,açlıktan nefesimiz kokuyor tavuk dürüm yemekten gına geldi başkan çıkmış suriyeli vatan hainlerine 150 m2 bahçeli ev yapalım diyor asgari ücret 2020 tl başkan halk perişan ağalık yapma zamanı mı şimdi. [SEP] diyarbakırlı analar eksik suriyeli çocuklar eksik o eksik bu eksik onu da sen yap bişeyler de sen doldur kardeşim.
bu makalede türkiye'deki suriyeli kadın ve çocukların sorunları 5 ana başlık altında ele alınmaktadır. bunlar 1 dil ve eğitim 2 çocuk işçiliği 3 çocuk gelin 4 insan ticareti fuhuş ve cinsel kölelik 5 uyuşturucu.,2,,diyarbakırlı analar eksik suriyeli çocuklar eksik o eksik bu eksik onu da sen yap bişeyler de sen doldur kardeşim. [SEP] bu makalede türkiye'deki suriyeli kadın ve çocukların sorunları 5 ana başlık altında ele alınmaktadır. bunlar 1 dil ve eğitim 2 çocuk işçiliği 3 çocuk gelin 4 insan ticareti fuhuş ve cinsel kölelik 5 uyuşturucu.
park caddesi sağlık ocağı taraflarında mobese falan var mı 2 suriyeli piç pezevenk bir bayanın arkasından şahit olmak istemediğim bir hareket yaptılar kız arkası dönük olduğu için farketmedi bense suratlarına dik dik bakabildim sadece onlarsa pişkin pişkin sırıtıp gittiler,1,etnik,bu makalede türkiye'deki suriyeli kadın ve çocukların sorunları 5 ana başlık altında ele alınmaktadır. bunlar 1 dil ve eğitim 2 çocuk işçiliği 3 çocuk gelin 4 insan ticareti fuhuş ve cinsel kölelik 5 uyuşturucu. [SEP] park caddesi sağlık ocağı taraflarında mobese falan var mı 2 suriyeli piç pezevenk bir bayanın arkasından şahit olmak istemediğim bir hareket yaptılar kız arkası dönük olduğu için farketmedi bense suratlarına dik dik bakabildim sadece onlarsa pişkin pişkin sırıtıp gittiler
300 m2 evin şu anki arsa bedelsiz maliyeti en az 450 bin tl. 150 m2 bahçe düzeni en az 30 bin tl. yaklaşık 480 bin tl sadece bir suriyeli aileye bahşedilecek sanırsam?,1,etnik,park caddesi sağlık ocağı taraflarında mobese falan var mı 2 suriyeli piç pezevenk bir bayanın arkasından şahit olmak istemediğim bir hareket yaptılar kız arkası dönük olduğu için farketmedi bense suratlarına dik dik bakabildim sadece onlarsa pişkin pişkin sırıtıp gittiler [SEP] 300 m2 evin şu anki arsa bedelsiz maliyeti en az 450 bin tl. 150 m2 bahçe düzeni en az 30 bin tl. yaklaşık 480 bin tl sadece bir suriyeli aileye bahşedilecek sanırsam?
içişleri bakanı süleyman soylu ekonominin çöküşü pahalılık zamlar vs de görev ihlali mi oluyor acaba vatandaş olarak ağzımıza sıçtınız. ölelim mi yandaşlar onun bunun adamları rahat yaşarken biz geberelim mi suriyeli kadar değerim yok bu ülkede,1,etnik,300 m2 evin şu anki arsa bedelsiz maliyeti en az 450 bin tl. 150 m2 bahçe düzeni en az 30 bin tl. yaklaşık 480 bin tl sadece bir suriyeli aileye bahşedilecek sanırsam? [SEP] içişleri bakanı süleyman soylu ekonominin çöküşü pahalılık zamlar vs de görev ihlali mi oluyor acaba vatandaş olarak ağzımıza sıçtınız. ölelim mi yandaşlar onun bunun adamları rahat yaşarken biz geberelim mi suriyeli kadar değerim yok bu ülkede
bir suriyeli tarafından taciz edilmediğim kalmıştı o da oldu kendi ülkemde mültecilerden çekiniyorum amk,1,etnik,içişleri bakanı süleyman soylu ekonominin çöküşü pahalılık zamlar vs de görev ihlali mi oluyor acaba vatandaş olarak ağzımıza sıçtınız. ölelim mi yandaşlar onun bunun adamları rahat yaşarken biz geberelim mi suriyeli kadar değerim yok bu ülkede [SEP] bir suriyeli tarafından taciz edilmediğim kalmıştı o da oldu kendi ülkemde mültecilerden çekiniyorum amk
ben hiç suriyeli çiftçi duymadım. ekip biçmek özveri ister çalışmak ister papatya ekmiyoruz. suriyeliler öğleden sonra uyanır sabah 5'te yatarlar. kim çiftçilik yapacak da ekip biçecek,1,etnik,bir suriyeli tarafından taciz edilmediğim kalmıştı o da oldu kendi ülkemde mültecilerden çekiniyorum amk [SEP] ben hiç suriyeli çiftçi duymadım. ekip biçmek özveri ister çalışmak ister papatya ekmiyoruz. suriyeliler öğleden sonra uyanır sabah 5'te yatarlar. kim çiftçilik yapacak da ekip biçecek
gençlik merkezimizde türkçe eğitimini tamamlayan suriyeli kardeşlerimize sertifika töreninde dondurma ikramında bulunduk.,2,,ben hiç suriyeli çiftçi duymadım. ekip biçmek özveri ister çalışmak ister papatya ekmiyoruz. suriyeliler öğleden sonra uyanır sabah 5'te yatarlar. kim çiftçilik yapacak da ekip biçecek [SEP] gençlik merkezimizde türkçe eğitimini tamamlayan suriyeli kardeşlerimize sertifika töreninde dondurma ikramında bulunduk.
o zaman niye suriyeli çalıştırana teşvik ve mülteci entegrasyonu için okul yapıyorsunuz. gönderin gitsin tiksindik artık görmek istemiyoruz suriyeli mülteci,1,etnik,gençlik merkezimizde türkçe eğitimini tamamlayan suriyeli kardeşlerimize sertifika töreninde dondurma ikramında bulunduk. [SEP] o zaman niye suriyeli çalıştırana teşvik ve mülteci entegrasyonu için okul yapıyorsunuz. gönderin gitsin tiksindik artık görmek istemiyoruz suriyeli mülteci
bu kadar işsizlik varken 1 suriyeli 1 türk kampanyası nedir ya şaka mı?! yeni kampanya istiyoruz 1 türk 1 yeni mezun türk #1suriyeli,1,etnik,o zaman niye suriyeli çalıştırana teşvik ve mülteci entegrasyonu için okul yapıyorsunuz. gönderin gitsin tiksindik artık görmek istemiyoruz suriyeli mülteci [SEP] bu kadar işsizlik varken 1 suriyeli 1 türk kampanyası nedir ya şaka mı?! yeni kampanya istiyoruz 1 türk 1 yeni mezun türk #1suriyeli
#hatırladınız mı? suriyeli 9 aylık hamile emani'yi yanında da 10 aylık bebeği ile birlikte tecavüz edip öldürülmüştüler eşinin giderken dediklerini hatırladınız mı? sakın kimseye tecavüz demeyin kaza diyin ailem türkiye'ye düşman olmasın.,2,,bu kadar işsizlik varken 1 suriyeli 1 türk kampanyası nedir ya şaka mı?! yeni kampanya istiyoruz 1 türk 1 yeni mezun türk #1suriyeli [SEP] #hatırladınız mı? suriyeli 9 aylık hamile emani'yi yanında da 10 aylık bebeği ile birlikte tecavüz edip öldürülmüştüler eşinin giderken dediklerini hatırladınız mı? sakın kimseye tecavüz demeyin kaza diyin ailem türkiye'ye düşman olmasın.
suriyeli işçi çalıştırana 11 bin 400 tl destek verilecek!,2,,#hatırladınız mı? suriyeli 9 aylık hamile emani'yi yanında da 10 aylık bebeği ile birlikte tecavüz edip öldürülmüştüler eşinin giderken dediklerini hatırladınız mı? sakın kimseye tecavüz demeyin kaza diyin ailem türkiye'ye düşman olmasın. [SEP] suriyeli işçi çalıştırana 11 bin 400 tl destek verilecek!
belki sığınmak zorunda kalmış hakkıyla yaşamaya çalışıyor. belki ülkeye senden daha çok faydası var. belki suriyeli bile değil başka ülkeden gelmiş yerleşmek veya gezmek için. ne biliyorsunuz da kötü davranıyorsunuz? niye bu kadar hırs ve kin dolusunuz?,2,,suriyeli işçi çalıştırana 11 bin 400 tl destek verilecek! [SEP] belki sığınmak zorunda kalmış hakkıyla yaşamaya çalışıyor. belki ülkeye senden daha çok faydası var. belki suriyeli bile değil başka ülkeden gelmiş yerleşmek veya gezmek için. ne biliyorsunuz da kötü davranıyorsunuz? niye bu kadar hırs ve kin dolusunuz?
böylece 1 suriyelinin yüzü gözü hürmetine bir türk iş sahibi olur. allah razı olsun suriyeli kardeşlerimizden. sayelerinde işsizlikle mücadele eden insanlar iş sahibi olacak,1,etnik,belki sığınmak zorunda kalmış hakkıyla yaşamaya çalışıyor. belki ülkeye senden daha çok faydası var. belki suriyeli bile değil başka ülkeden gelmiş yerleşmek veya gezmek için. ne biliyorsunuz da kötü davranıyorsunuz? niye bu kadar hırs ve kin dolusunuz? [SEP] böylece 1 suriyelinin yüzü gözü hürmetine bir türk iş sahibi olur. allah razı olsun suriyeli kardeşlerimizden. sayelerinde işsizlikle mücadele eden insanlar iş sahibi olacak
suriyeli kadın ile,2,,böylece 1 suriyelinin yüzü gözü hürmetine bir türk iş sahibi olur. allah razı olsun suriyeli kardeşlerimizden. sayelerinde işsizlikle mücadele eden insanlar iş sahibi olacak [SEP] suriyeli kadın ile
evcil hayvanınızla fotoğraf çekilmeyi nasıl başarıyorsunuz. benimki kamerayı görünce vergi görmüş suriyeli gibi kaçıyor da.,1,etnik,suriyeli kadın ile [SEP] evcil hayvanınızla fotoğraf çekilmeyi nasıl başarıyorsunuz. benimki kamerayı görünce vergi görmüş suriyeli gibi kaçıyor da.
suriyeli ilk kapıya geldiğinde kapıları açtınız ve halk onlara destek olup yardım etti. ama sayıları 5 milyonu bulup bir sürü sorun oluşunca haliyle yeter bitsin bu misafirlik dedi. bu da gayet doğal. bu kadar fedakarlıktan sonra bu halk yorulup yeter dedi diye vefasızlık etmeyin,2,,evcil hayvanınızla fotoğraf çekilmeyi nasıl başarıyorsunuz. benimki kamerayı görünce vergi görmüş suriyeli gibi kaçıyor da. [SEP] suriyeli ilk kapıya geldiğinde kapıları açtınız ve halk onlara destek olup yardım etti. ama sayıları 5 milyonu bulup bir sürü sorun oluşunca haliyle yeter bitsin bu misafirlik dedi. bu da gayet doğal. bu kadar fedakarlıktan sonra bu halk yorulup yeter dedi diye vefasızlık etmeyin
"kılıçdaroğlu ""afrin'de sorun çıktı şimdi 3 milyon suriyeli daha gelecek. bakın göreceksiniz.""",2,,"suriyeli ilk kapıya geldiğinde kapıları açtınız ve halk onlara destek olup yardım etti. ama sayıları 5 milyonu bulup bir sürü sorun oluşunca haliyle yeter bitsin bu misafirlik dedi. bu da gayet doğal. bu kadar fedakarlıktan sonra bu halk yorulup yeter dedi diye vefasızlık etmeyin [SEP] kılıçdaroğlu ""afrin'de sorun çıktı şimdi 3 milyon suriyeli daha gelecek. bakın göreceksiniz."""
#sondakika cumhurbaşkanı erdoğan'dan abd ve ab'ye suriyeli mülteciler mesajı kapıları açmak zorunda kalırız. ab başta olmak üzere dünyadan olması gereken desteği alamadık almak için de bunu yapmak zorunda kalabiliriz,2,,"kılıçdaroğlu ""afrin'de sorun çıktı şimdi 3 milyon suriyeli daha gelecek. bakın göreceksiniz."" [SEP] #sondakika cumhurbaşkanı erdoğan'dan abd ve ab'ye suriyeli mülteciler mesajı kapıları açmak zorunda kalırız. ab başta olmak üzere dünyadan olması gereken desteği alamadık almak için de bunu yapmak zorunda kalabiliriz"
suriyeli bir talibim varsa açılabilir en azından gitmez,2,,#sondakika cumhurbaşkanı erdoğan'dan abd ve ab'ye suriyeli mülteciler mesajı kapıları açmak zorunda kalırız. ab başta olmak üzere dünyadan olması gereken desteği alamadık almak için de bunu yapmak zorunda kalabiliriz [SEP] suriyeli bir talibim varsa açılabilir en azından gitmez
1 suriyeli 1 türk yine 2. sınıf vatandaş muamelesi,1,etnik,suriyeli bir talibim varsa açılabilir en azından gitmez [SEP] 1 suriyeli 1 türk yine 2. sınıf vatandaş muamelesi
çalışma bakanlığı öncülüğünde başlatılan programa göre suriyeli işçi çalıştırılan işyerlerine 11 bin 400 tl'ye kadar teşvik verilecek. bu proje ile suriyelilerin sigortalı çalıştırılmasının önü açılacakmış!,2,,1 suriyeli 1 türk yine 2. sınıf vatandaş muamelesi [SEP] çalışma bakanlığı öncülüğünde başlatılan programa göre suriyeli işçi çalıştırılan işyerlerine 11 bin 400 tl'ye kadar teşvik verilecek. bu proje ile suriyelilerin sigortalı çalıştırılmasının önü açılacakmış!
suriyeli ülkesine dönsün demek suriyeliden nefret etmek ya da ölürse ölsün demek değil. vatandaşın maddi manevi çektiği sıkıntılardan kurtulmak isteyişi. siz de kabul ettiğiniz üzere büyük bir sıkıntı var ve bu yük en çok halkın üstünde. bir de vicdansız diye iftira etmeyin artık.,2,,çalışma bakanlığı öncülüğünde başlatılan programa göre suriyeli işçi çalıştırılan işyerlerine 11 bin 400 tl'ye kadar teşvik verilecek. bu proje ile suriyelilerin sigortalı çalıştırılmasının önü açılacakmış! [SEP] suriyeli ülkesine dönsün demek suriyeliden nefret etmek ya da ölürse ölsün demek değil. vatandaşın maddi manevi çektiği sıkıntılardan kurtulmak isteyişi. siz de kabul ettiğiniz üzere büyük bir sıkıntı var ve bu yük en çok halkın üstünde. bir de vicdansız diye iftira etmeyin artık.
neden suriyeli ile birlikte türk işe alındığında teşvik veriliyor. iyice adamların yanında promosyon olduk. iki türk alınsın suriyeli de kendi memleketine dönsün.,1,etnik,suriyeli ülkesine dönsün demek suriyeliden nefret etmek ya da ölürse ölsün demek değil. vatandaşın maddi manevi çektiği sıkıntılardan kurtulmak isteyişi. siz de kabul ettiğiniz üzere büyük bir sıkıntı var ve bu yük en çok halkın üstünde. bir de vicdansız diye iftira etmeyin artık. [SEP] neden suriyeli ile birlikte türk işe alındığında teşvik veriliyor. iyice adamların yanında promosyon olduk. iki türk alınsın suriyeli de kendi memleketine dönsün.
polis baskın yaptı onlar türk kahvesi içti! rahatlıkları pes dedirtti haberin devamı #yenikapı #suriye #suriyeli #haber #perşembe #avrupayakasıyenidenbaşlasın #haydi12adam #makam #renault #gözucutr #sondakika,2,,neden suriyeli ile birlikte türk işe alındığında teşvik veriliyor. iyice adamların yanında promosyon olduk. iki türk alınsın suriyeli de kendi memleketine dönsün. [SEP] polis baskın yaptı onlar türk kahvesi içti! rahatlıkları pes dedirtti haberin devamı #yenikapı #suriye #suriyeli #haber #perşembe #avrupayakasıyenidenbaşlasın #haydi12adam #makam #renault #gözucutr #sondakika
kılıçdaroğlu “afrin'de sorun çıktı şimdi 3 milyon suriyeli daha gelecek. bakın göreceksiniz.” #foxhaber #afrin #suriye,2,,polis baskın yaptı onlar türk kahvesi içti! rahatlıkları pes dedirtti haberin devamı #yenikapı #suriye #suriyeli #haber #perşembe #avrupayakasıyenidenbaşlasın #haydi12adam #makam #renault #gözucutr #sondakika [SEP] kılıçdaroğlu “afrin'de sorun çıktı şimdi 3 milyon suriyeli daha gelecek. bakın göreceksiniz.” #foxhaber #afrin #suriye
cumhurbaşkanı erdoğan yeni göç dalgasıyla sınırımıza gelen suriyelilere kapılarımızı açmak zorunda kalabiliriz diyor. ne zorunluluğu 5 milyon sayıları vardı şimdi kaç milyon daha gelecek. ben ülkemde değil 5 milyon bir tane bile suriyeli istemiyorum. burası benim vatanım,1,etnik,kılıçdaroğlu “afrin'de sorun çıktı şimdi 3 milyon suriyeli daha gelecek. bakın göreceksiniz.” #foxhaber #afrin #suriye [SEP] cumhurbaşkanı erdoğan yeni göç dalgasıyla sınırımıza gelen suriyelilere kapılarımızı açmak zorunda kalabiliriz diyor. ne zorunluluğu 5 milyon sayıları vardı şimdi kaç milyon daha gelecek. ben ülkemde değil 5 milyon bir tane bile suriyeli istemiyorum. burası benim vatanım
türkiye'deki suriyeli girişimcilerin yüzde 72'si savaş bitse bile ülkesine dönmek istemiyor,2,,cumhurbaşkanı erdoğan yeni göç dalgasıyla sınırımıza gelen suriyelilere kapılarımızı açmak zorunda kalabiliriz diyor. ne zorunluluğu 5 milyon sayıları vardı şimdi kaç milyon daha gelecek. ben ülkemde değil 5 milyon bir tane bile suriyeli istemiyorum. burası benim vatanım [SEP] türkiye'deki suriyeli girişimcilerin yüzde 72'si savaş bitse bile ülkesine dönmek istemiyor
kılıçdaroğlu böyle giderse 3 milyon suriyeli daha gelecek,2,,türkiye'deki suriyeli girişimcilerin yüzde 72'si savaş bitse bile ülkesine dönmek istemiyor [SEP] kılıçdaroğlu böyle giderse 3 milyon suriyeli daha gelecek
istanbul fatih'te önce suriyeli zannettiğim sonradan filistinli olduklarını öğrendiğim 2 filistinliye rastladım sevindim kardeşlerim hoşgeldiniz dedim hoşbeş muhabbet derken sorgu bölümüne geçtik sordum buraya nasıl geldiniz? suudi arabistan üzerindenmiş,2,,kılıçdaroğlu böyle giderse 3 milyon suriyeli daha gelecek [SEP] istanbul fatih'te önce suriyeli zannettiğim sonradan filistinli olduklarını öğrendiğim 2 filistinliye rastladım sevindim kardeşlerim hoşgeldiniz dedim hoşbeş muhabbet derken sorgu bölümüne geçtik sordum buraya nasıl geldiniz? suudi arabistan üzerindenmiş
ülkelerine dönmeleri için bir sebep kalmadı suriyeli işçi çalıştırana 11 bin 400 lira destek verilecek!,2,,istanbul fatih'te önce suriyeli zannettiğim sonradan filistinli olduklarını öğrendiğim 2 filistinliye rastladım sevindim kardeşlerim hoşgeldiniz dedim hoşbeş muhabbet derken sorgu bölümüne geçtik sordum buraya nasıl geldiniz? suudi arabistan üzerindenmiş [SEP] ülkelerine dönmeleri için bir sebep kalmadı suriyeli işçi çalıştırana 11 bin 400 lira destek verilecek!
alt katta inşaat çalışması var. matkap sesinin daha ne kadar süreceğini sormak için indim. suriyeli bir çocuk çalışıyordu evde. dedim bu ses ne kadar sürecek? immm 11 dakika dedi. zaman belirlemede suriyeli gibi ol.,2,,ülkelerine dönmeleri için bir sebep kalmadı suriyeli işçi çalıştırana 11 bin 400 lira destek verilecek! [SEP] alt katta inşaat çalışması var. matkap sesinin daha ne kadar süreceğini sormak için indim. suriyeli bir çocuk çalışıyordu evde. dedim bu ses ne kadar sürecek? immm 11 dakika dedi. zaman belirlemede suriyeli gibi ol.
"eeeyyy rubin? 3,5 milyon suriyeli ülkesini terk edip türkiye'ye geldi. bu şu demek abd ve kürtler bölgede etnik temizlik yaptı demek. bölgeyi kontrol etme hakkı suriyededir o yapamıyorsa türkiye'dedir. orada abd'nin kürdün ne işi var?...",1,etnik,"alt katta inşaat çalışması var. matkap sesinin daha ne kadar süreceğini sormak için indim. suriyeli bir çocuk çalışıyordu evde. dedim bu ses ne kadar sürecek? immm 11 dakika dedi. zaman belirlemede suriyeli gibi ol. [SEP] eeeyyy rubin? 3,5 milyon suriyeli ülkesini terk edip türkiye'ye geldi. bu şu demek abd ve kürtler bölgede etnik temizlik yaptı demek. bölgeyi kontrol etme hakkı suriyededir o yapamıyorsa türkiye'dedir. orada abd'nin kürdün ne işi var?..."
suriyeli sığınmacılar konusunda ab başta olmak üzere dünyadan gerekli desteği alamadık almak...,2,,"eeeyyy rubin? 3,5 milyon suriyeli ülkesini terk edip türkiye'ye geldi. bu şu demek abd ve kürtler bölgede etnik temizlik yaptı demek. bölgeyi kontrol etme hakkı suriyededir o yapamıyorsa türkiye'dedir. orada abd'nin kürdün ne işi var?... [SEP] suriyeli sığınmacılar konusunda ab başta olmak üzere dünyadan gerekli desteği alamadık almak..."
devletimiz suriyeli işçi çalıştıran firmalara 11.400 tl destek vereceğini açıklamış. allah sizi bildiği gibi yapsın. ! #perşembe #suriyeliistemiyoruz,1,etnik,suriyeli sığınmacılar konusunda ab başta olmak üzere dünyadan gerekli desteği alamadık almak... [SEP] devletimiz suriyeli işçi çalıştıran firmalara 11.400 tl destek vereceğini açıklamış. allah sizi bildiği gibi yapsın. ! #perşembe #suriyeliistemiyoruz
adana'da suriyeli çok birine aşık olacağım diye korkuyorum çünkü güzeller,2,,devletimiz suriyeli işçi çalıştıran firmalara 11.400 tl destek vereceğini açıklamış. allah sizi bildiği gibi yapsın. ! #perşembe #suriyeliistemiyoruz [SEP] adana'da suriyeli çok birine aşık olacağım diye korkuyorum çünkü güzeller
cumhurbaşkanı #erdoğan hedefimiz suriyeli kardeşlerimizden en az 1 milyonunu 450 kilometrelik sınır hattı boyunca oluşturacağımız güvenli bölgede iskan etmektir...,2,,adana'da suriyeli çok birine aşık olacağım diye korkuyorum çünkü güzeller [SEP] cumhurbaşkanı #erdoğan hedefimiz suriyeli kardeşlerimizden en az 1 milyonunu 450 kilometrelik sınır hattı boyunca oluşturacağımız güvenli bölgede iskan etmektir...
ya adama bakar mısınız sanki babasının evinin kapısını açıyor... insanlar rezil olmuş rezillik paçalardan akıyor istemiyoruz sn cumhurbaşkanı ülkemizde suriyeli istemiyoruz bir halkına sor bakalım biz bunları istemiyoruz!,1,etnik,cumhurbaşkanı #erdoğan hedefimiz suriyeli kardeşlerimizden en az 1 milyonunu 450 kilometrelik sınır hattı boyunca oluşturacağımız güvenli bölgede iskan etmektir... [SEP] ya adama bakar mısınız sanki babasının evinin kapısını açıyor... insanlar rezil olmuş rezillik paçalardan akıyor istemiyoruz sn cumhurbaşkanı ülkemizde suriyeli istemiyoruz bir halkına sor bakalım biz bunları istemiyoruz!
bu avrupa birliği harbiden mal... bu konuda türkiye'nin yanında olması gerekirken karşısında oluyor... be salak herifler kapıları açtığımızda ne bok yiyeceksiniz... akp en çok suriyeli konusundan gol yedi suriye tarafından yeni bir göç dalgası olursa e mecbur kapıları açacak,0,,ya adama bakar mısınız sanki babasının evinin kapısını açıyor... insanlar rezil olmuş rezillik paçalardan akıyor istemiyoruz sn cumhurbaşkanı ülkemizde suriyeli istemiyoruz bir halkına sor bakalım biz bunları istemiyoruz! [SEP] bu avrupa birliği harbiden mal... bu konuda türkiye'nin yanında olması gerekirken karşısında oluyor... be salak herifler kapıları açtığımızda ne bok yiyeceksiniz... akp en çok suriyeli konusundan gol yedi suriye tarafından yeni bir göç dalgası olursa e mecbur kapıları açacak
