Tweet,Etiket,Alt Etiket,CONTEXT_INPUT
sünni kardeşlerimizin kadir gecesi'nde orucunu tutuyorum alevi kardeşlerimizin 10. gününde oruç tutuyorum. kimse kırılmasın hak geçmesin. yalnız bu oruç baya zormuş su et falan yok,2,,tüm binamız sokağımız ve mahallemiz alevi ama aşure yok. inanabiliyor musunuz ya? birazdan alt komşu hatice teyzeyi ve diğer mahalle sakinlerimizi derhal aşure yapmaları konusunda uyaracağım. [SEP] sünni kardeşlerimizin kadir gecesi'nde orucunu tutuyorum alevi kardeşlerimizin 10. gününde oruç tutuyorum. kimse kırılmasın hak geçmesin. yalnız bu oruç baya zormuş su et falan yok
alevi aşura töreni alevi ashura ceremony,2,,sünni kardeşlerimizin kadir gecesi'nde orucunu tutuyorum alevi kardeşlerimizin 10. gününde oruç tutuyorum. kimse kırılmasın hak geçmesin. yalnız bu oruç baya zormuş su et falan yok [SEP] alevi aşura töreni alevi ashura ceremony
ateşte de olay pire mi deve mi onu seçemiyorum saman alevi sönene kadar dkskkddkdjdks,2,,alevi aşura töreni alevi ashura ceremony [SEP] ateşte de olay pire mi deve mi onu seçemiyorum saman alevi sönene kadar dkskkddkdjdks
bu akşam binlerce cemevinde sevgili peygamberimizin torunu hz. hüseyin ve yanındakilerin kerbela'da şehit edilmelerinden dolayı matem törenleri düzenleniyor. milyonlarca alevi ile birlikte ben de bir sünni ailenin evladı olarak okunan ağıtlara katılacağım.,2,,ateşte de olay pire mi deve mi onu seçemiyorum saman alevi sönene kadar dkskkddkdjdks [SEP] bu akşam binlerce cemevinde sevgili peygamberimizin torunu hz. hüseyin ve yanındakilerin kerbela'da şehit edilmelerinden dolayı matem törenleri düzenleniyor. milyonlarca alevi ile birlikte ben de bir sünni ailenin evladı olarak okunan ağıtlara katılacağım.
hani bir alevi türküsü vardır... ağlama gönül ağlama sen ali'den yüce misin? diye. türk yargısının sahte delillerle kumpas kurulmuştur dediği yerde siz türk yargısından daha mı yücesiniz ki bu fetö kumpasını meşru görüyorsunuz?,2,,bu akşam binlerce cemevinde sevgili peygamberimizin torunu hz. hüseyin ve yanındakilerin kerbela'da şehit edilmelerinden dolayı matem törenleri düzenleniyor. milyonlarca alevi ile birlikte ben de bir sünni ailenin evladı olarak okunan ağıtlara katılacağım. [SEP] hani bir alevi türküsü vardır... ağlama gönül ağlama sen ali'den yüce misin? diye. türk yargısının sahte delillerle kumpas kurulmuştur dediği yerde siz türk yargısından daha mı yücesiniz ki bu fetö kumpasını meşru görüyorsunuz?
saman alevi sinirim online cızz,2,,hani bir alevi türküsü vardır... ağlama gönül ağlama sen ali'den yüce misin? diye. türk yargısının sahte delillerle kumpas kurulmuştur dediği yerde siz türk yargısından daha mı yücesiniz ki bu fetö kumpasını meşru görüyorsunuz? [SEP] saman alevi sinirim online cızz
şah hüseyn-i kerbela'nın baş açık abdalıyam kıblegahımdır muhammed secdegahımdır ali. şah hatayı #alevi #türküler #alevicanlar #deyişler,2,,saman alevi sinirim online cızz [SEP] şah hüseyn-i kerbela'nın baş açık abdalıyam kıblegahımdır muhammed secdegahımdır ali. şah hatayı #alevi #türküler #alevicanlar #deyişler
bu sene aşure getiren de olmadı alevi komşularımız da yapmamış candan seslendim yok bu sene yapmadım niye gıı dedim işten geliyorum yorgunum dedi #asure #pazartesi,2,,şah hüseyn-i kerbela'nın baş açık abdalıyam kıblegahımdır muhammed secdegahımdır ali. şah hatayı #alevi #türküler #alevicanlar #deyişler [SEP] bu sene aşure getiren de olmadı alevi komşularımız da yapmamış candan seslendim yok bu sene yapmadım niye gıı dedim işten geliyorum yorgunum dedi #asure #pazartesi
meclis başkan vekilimiz mithat sancar başkanlığındaki heyetimiz kayyım darbesi başta olmak üzere yargı paketi demokrasi ittifakı ve demokratik anayasa görüşmelerimiz kapsamında alevi bektaşi federasyonu ve pir sultan abdal kültür derneği temsilcileri ile bir araya geldi.,2,,bu sene aşure getiren de olmadı alevi komşularımız da yapmamış candan seslendim yok bu sene yapmadım niye gıı dedim işten geliyorum yorgunum dedi #asure #pazartesi [SEP] meclis başkan vekilimiz mithat sancar başkanlığındaki heyetimiz kayyım darbesi başta olmak üzere yargı paketi demokrasi ittifakı ve demokratik anayasa görüşmelerimiz kapsamında alevi bektaşi federasyonu ve pir sultan abdal kültür derneği temsilcileri ile bir araya geldi.
taha akyol'un şu kitabı baya iyidir. celali ve alevi isyanların salt mezhebi değil türkmenin yörüğün geçim derdi olduğunu anlatır. vergi meselesi sıkıntılı mevzu,2,,meclis başkan vekilimiz mithat sancar başkanlığındaki heyetimiz kayyım darbesi başta olmak üzere yargı paketi demokrasi ittifakı ve demokratik anayasa görüşmelerimiz kapsamında alevi bektaşi federasyonu ve pir sultan abdal kültür derneği temsilcileri ile bir araya geldi. [SEP] taha akyol'un şu kitabı baya iyidir. celali ve alevi isyanların salt mezhebi değil türkmenin yörüğün geçim derdi olduğunu anlatır. vergi meselesi sıkıntılı mevzu
bugün muharrem ayı ve kerbela bütün alevi müslüman arkadaşlarıma acılarımız aynıdır,2,,taha akyol'un şu kitabı baya iyidir. celali ve alevi isyanların salt mezhebi değil türkmenin yörüğün geçim derdi olduğunu anlatır. vergi meselesi sıkıntılı mevzu [SEP] bugün muharrem ayı ve kerbela bütün alevi müslüman arkadaşlarıma acılarımız aynıdır
temelli bir tek tanrı inancıydı bu. bu anlayış islam'dan sonra bile alttan alta sürdü geldi. alevi denilen kitle bu inancı bugünlere kadar islam ile harmanlayarak taşıdı. islam'dan çok eskidir türkler tanrı kavramına bütün milletlerden önce ulaşmışlardır.,2,,bugün muharrem ayı ve kerbela bütün alevi müslüman arkadaşlarıma acılarımız aynıdır [SEP] temelli bir tek tanrı inancıydı bu. bu anlayış islam'dan sonra bile alttan alta sürdü geldi. alevi denilen kitle bu inancı bugünlere kadar islam ile harmanlayarak taşıdı. islam'dan çok eskidir türkler tanrı kavramına bütün milletlerden önce ulaşmışlardır.
burada alevi kavramını toplumsal bir aidiyetten ziyade fikri ve hissi bir aidiyet anlamında daha geniş kapsamda kullanıyorum. bu fikri ve hissi paylaşan herkese açıktır.,2,,temelli bir tek tanrı inancıydı bu. bu anlayış islam'dan sonra bile alttan alta sürdü geldi. alevi denilen kitle bu inancı bugünlere kadar islam ile harmanlayarak taşıdı. islam'dan çok eskidir türkler tanrı kavramına bütün milletlerden önce ulaşmışlardır. [SEP] burada alevi kavramını toplumsal bir aidiyetten ziyade fikri ve hissi bir aidiyet anlamında daha geniş kapsamda kullanıyorum. bu fikri ve hissi paylaşan herkese açıktır.
hz. muhammed'den kerbela'ya kerbela'dan günümüze hak muhammet ali diyen alevi canlarımızla devletimizin devletimizle de alevi canların kucaklaşma zamanı. gelin canlar bir olalım. büyük türkiye olalım. usesam yönetim kurulu başkanı avukat psikolog sosyolog alevi dedesi müseyip erdoğmuş,2,,burada alevi kavramını toplumsal bir aidiyetten ziyade fikri ve hissi bir aidiyet anlamında daha geniş kapsamda kullanıyorum. bu fikri ve hissi paylaşan herkese açıktır. [SEP] hz. muhammed'den kerbela'ya kerbela'dan günümüze hak muhammet ali diyen alevi canlarımızla devletimizin devletimizle de alevi canların kucaklaşma zamanı. gelin canlar bir olalım. büyük türkiye olalım. usesam yönetim kurulu başkanı avukat psikolog sosyolog alevi dedesi müseyip erdoğmuş
kor bir alevi tutar iki elim hak mı bu bana?,2,,hz. muhammed'den kerbela'ya kerbela'dan günümüze hak muhammet ali diyen alevi canlarımızla devletimizin devletimizle de alevi canların kucaklaşma zamanı. gelin canlar bir olalım. büyük türkiye olalım. usesam yönetim kurulu başkanı avukat psikolog sosyolog alevi dedesi müseyip erdoğmuş [SEP] kor bir alevi tutar iki elim hak mı bu bana?
en yakın arkadaşlarımdan biri kürttü biri alevi hala severim hala isimlerini anarım semboller geçici sevelim birbirimizi ya bu kadar mı zor ben anlamıyorum! hayır illa böyle bayram şekeri gibi konuşmak zorunda mıyım! bak yine atarlandım,2,,kor bir alevi tutar iki elim hak mı bu bana? [SEP] en yakın arkadaşlarımdan biri kürttü biri alevi hala severim hala isimlerini anarım semboller geçici sevelim birbirimizi ya bu kadar mı zor ben anlamıyorum! hayır illa böyle bayram şekeri gibi konuşmak zorunda mıyım! bak yine atarlandım
alevi ve sünni çekişmesi ilk hazreti ali efendimizin şehit edilmesinden sonra büyük ivme kazanmıştır. esas çekişme peygamberin vefatı sonrası imamet konusunda çıktı abdullah bin sebe yahudisi konusu sünnilerin götünden element uydurma hadisesidir.,1,dini,en yakın arkadaşlarımdan biri kürttü biri alevi hala severim hala isimlerini anarım semboller geçici sevelim birbirimizi ya bu kadar mı zor ben anlamıyorum! hayır illa böyle bayram şekeri gibi konuşmak zorunda mıyım! bak yine atarlandım [SEP] alevi ve sünni çekişmesi ilk hazreti ali efendimizin şehit edilmesinden sonra büyük ivme kazanmıştır. esas çekişme peygamberin vefatı sonrası imamet konusunda çıktı abdullah bin sebe yahudisi konusu sünnilerin götünden element uydurma hadisesidir.
genel olarak bu gibi müdahaleler enflasyonun artmasına yol açar artan fiyatlar yine tüketicinin cebinden ödenir. para arzını arttırarak sağlanan ekonomik canlanma uzun sürmez ve saman alevi gibi parlayıp geçer.,2,,alevi ve sünni çekişmesi ilk hazreti ali efendimizin şehit edilmesinden sonra büyük ivme kazanmıştır. esas çekişme peygamberin vefatı sonrası imamet konusunda çıktı abdullah bin sebe yahudisi konusu sünnilerin götünden element uydurma hadisesidir. [SEP] genel olarak bu gibi müdahaleler enflasyonun artmasına yol açar artan fiyatlar yine tüketicinin cebinden ödenir. para arzını arttırarak sağlanan ekonomik canlanma uzun sürmez ve saman alevi gibi parlayıp geçer.
mecliste siyaset yapmanın anlamı yok. çekilin şu parlamentodan. kürt halkı sizin dönekliğiniz yüzünden direnişçiliğini kaybediyor. chp'nin kuyruğuna takılmaktan vazgeçin. yüzünüzü burjuvaziye değil ezilen halklara dönün.,0,,genel olarak bu gibi müdahaleler enflasyonun artmasına yol açar artan fiyatlar yine tüketicinin cebinden ödenir. para arzını arttırarak sağlanan ekonomik canlanma uzun sürmez ve saman alevi gibi parlayıp geçer. [SEP] mecliste siyaset yapmanın anlamı yok. çekilin şu parlamentodan. kürt halkı sizin dönekliğiniz yüzünden direnişçiliğini kaybediyor. chp'nin kuyruğuna takılmaktan vazgeçin. yüzünüzü burjuvaziye değil ezilen halklara dönün.
hz ali çok havalı alevi olsaydım keşke. hz muhammed'in bir fotosu bile yok çok çirkindi herhalde,1,dini,mecliste siyaset yapmanın anlamı yok. çekilin şu parlamentodan. kürt halkı sizin dönekliğiniz yüzünden direnişçiliğini kaybediyor. chp'nin kuyruğuna takılmaktan vazgeçin. yüzünüzü burjuvaziye değil ezilen halklara dönün. [SEP] hz ali çok havalı alevi olsaydım keşke. hz muhammed'in bir fotosu bile yok çok çirkindi herhalde
o kadar fabrika yandı bu sefer sadece 2 taneyi üstlenmişler. biz de inandık... paravan ateşin çocukları yakıyor hbdh de işine geleni üstleniyor işine gelmeyeni üstlenmiyor.,2,,hz ali çok havalı alevi olsaydım keşke. hz muhammed'in bir fotosu bile yok çok çirkindi herhalde [SEP] o kadar fabrika yandı bu sefer sadece 2 taneyi üstlenmişler. biz de inandık... paravan ateşin çocukları yakıyor hbdh de işine geleni üstleniyor işine gelmeyeni üstlenmiyor.
"akp genel başkanı erdoğan malatya'da canlı yayında ""kardeşlerim sünni alevi ayrımı var mı? biz hiçbir zaman böyle bir ayrım yapmadık"" bakalım 2014 cumhurbaşkanlığı seçimi mitinginde ne demiş?",2,,"o kadar fabrika yandı bu sefer sadece 2 taneyi üstlenmişler. biz de inandık... paravan ateşin çocukları yakıyor hbdh de işine geleni üstleniyor işine gelmeyeni üstlenmiyor. [SEP] akp genel başkanı erdoğan malatya'da canlı yayında ""kardeşlerim sünni alevi ayrımı var mı? biz hiçbir zaman böyle bir ayrım yapmadık"" bakalım 2014 cumhurbaşkanlığı seçimi mitinginde ne demiş?"
#ahmetyenilmez sizin şu bulunduğunuz resim yüzyıl öncesinin intikamını almaya gelmiş olanlara verilmiş türkün kürdün lazın çerkezin alevinin sünninin analarının duruşu. ben onun için geldim buraya...,2,,"akp genel başkanı erdoğan malatya'da canlı yayında ""kardeşlerim sünni alevi ayrımı var mı? biz hiçbir zaman böyle bir ayrım yapmadık"" bakalım 2014 cumhurbaşkanlığı seçimi mitinginde ne demiş? [SEP] #ahmetyenilmez sizin şu bulunduğunuz resim yüzyıl öncesinin intikamını almaya gelmiş olanlara verilmiş türkün kürdün lazın çerkezin alevinin sünninin analarının duruşu. ben onun için geldim buraya..."
kardeş türküler bugün güzellerin sah-i gördüm tanıdığım en alevi bireye gelsin... :),2,,#ahmetyenilmez sizin şu bulunduğunuz resim yüzyıl öncesinin intikamını almaya gelmiş olanlara verilmiş türkün kürdün lazın çerkezin alevinin sünninin analarının duruşu. ben onun için geldim buraya... [SEP] kardeş türküler bugün güzellerin sah-i gördüm tanıdığım en alevi bireye gelsin... :)
alevi mi? alevrimi mi? saz çalmakla alevi olunmaz...,2,,kardeş türküler bugün güzellerin sah-i gördüm tanıdığım en alevi bireye gelsin... :) [SEP] alevi mi? alevrimi mi? saz çalmakla alevi olunmaz...
kılıçdaroğlu'nun kendisi alevi siyasi partinin başında neyi eksik? diyen kimdi ?,2,,alevi mi? alevrimi mi? saz çalmakla alevi olunmaz... [SEP] kılıçdaroğlu'nun kendisi alevi siyasi partinin başında neyi eksik? diyen kimdi ?
sy jb siz alevi ile bir olamazsınız aleviler eline beline diline hakim olan kişilerdir,2,,kılıçdaroğlu'nun kendisi alevi siyasi partinin başında neyi eksik? diyen kimdi ? [SEP] sy jb siz alevi ile bir olamazsınız aleviler eline beline diline hakim olan kişilerdir
ya biz süryaniyiz ya onlar alevi!,2,,sy jb siz alevi ile bir olamazsınız aleviler eline beline diline hakim olan kişilerdir [SEP] ya biz süryaniyiz ya onlar alevi!
"denize atılan izmariti konu ederken lgbti alevi ve kürt'ü veya en azından genel çerçevesiyle ""ayrımcılığı"" konu etmemeleri de bir tercihtir ve bu da politiktir. bu tercihlerinden dolayı da eleştirilmeyi göze almış olmaları gerekir.",2,,"ya biz süryaniyiz ya onlar alevi! [SEP] denize atılan izmariti konu ederken lgbti alevi ve kürt'ü veya en azından genel çerçevesiyle ""ayrımcılığı"" konu etmemeleri de bir tercihtir ve bu da politiktir. bu tercihlerinden dolayı da eleştirilmeyi göze almış olmaları gerekir."
çalıştığım yerde malatya'nın köyünden misin merkezinden mi diye soruyorlar bu şey demek alevi misin sünni misin,2,,"denize atılan izmariti konu ederken lgbti alevi ve kürt'ü veya en azından genel çerçevesiyle ""ayrımcılığı"" konu etmemeleri de bir tercihtir ve bu da politiktir. bu tercihlerinden dolayı da eleştirilmeyi göze almış olmaları gerekir. [SEP] çalıştığım yerde malatya'nın köyünden misin merkezinden mi diye soruyorlar bu şey demek alevi misin sünni misin"
"bazen su olmak lazım sessiz sakin! bazen sel olmak lazım öfkeli ve hırçın! bazen mum alevi sabırla tükenmeyi bekleyen! bazense volkan önüne gelen her şeyi hızla tüketen! kimine su olacaksın kimine sel! kimine mum olacaksın kimine volkan! ama kimseye asla ""kul"" olmayacaksın!",2,,"çalıştığım yerde malatya'nın köyünden misin merkezinden mi diye soruyorlar bu şey demek alevi misin sünni misin [SEP] bazen su olmak lazım sessiz sakin! bazen sel olmak lazım öfkeli ve hırçın! bazen mum alevi sabırla tükenmeyi bekleyen! bazense volkan önüne gelen her şeyi hızla tüketen! kimine su olacaksın kimine sel! kimine mum olacaksın kimine volkan! ama kimseye asla ""kul"" olmayacaksın!"
disa barış okulu 7 eylül cumartesi günü cuma çiçek ve vivet alevi'nin seminerleriyle başladı. ilk gün toplumsal barışın inşasında sivil toplumun rolüne dair teorik bir çerçeve çizildi ve grup içi sosyalleşmede şiddetsiz iletişimin önemi konuşuldu.,2,,"bazen su olmak lazım sessiz sakin! bazen sel olmak lazım öfkeli ve hırçın! bazen mum alevi sabırla tükenmeyi bekleyen! bazense volkan önüne gelen her şeyi hızla tüketen! kimine su olacaksın kimine sel! kimine mum olacaksın kimine volkan! ama kimseye asla ""kul"" olmayacaksın! [SEP] disa barış okulu 7 eylül cumartesi günü cuma çiçek ve vivet alevi'nin seminerleriyle başladı. ilk gün toplumsal barışın inşasında sivil toplumun rolüne dair teorik bir çerçeve çizildi ve grup içi sosyalleşmede şiddetsiz iletişimin önemi konuşuldu."
avşar alevi türkmenlerinin anadolu ve suriye geçmişi büyük sahabe hazreti ali ra bin ebu talib'e ve hatta peygamber muhammed mustafa sav efendimizin hendek muharebesine dek dayanır. hz muhammed aleyhisselam hendek muharebesinde ilk kez bir türk ailesiyle haşir neşir olur.,2,,disa barış okulu 7 eylül cumartesi günü cuma çiçek ve vivet alevi'nin seminerleriyle başladı. ilk gün toplumsal barışın inşasında sivil toplumun rolüne dair teorik bir çerçeve çizildi ve grup içi sosyalleşmede şiddetsiz iletişimin önemi konuşuldu. [SEP] avşar alevi türkmenlerinin anadolu ve suriye geçmişi büyük sahabe hazreti ali ra bin ebu talib'e ve hatta peygamber muhammed mustafa sav efendimizin hendek muharebesine dek dayanır. hz muhammed aleyhisselam hendek muharebesinde ilk kez bir türk ailesiyle haşir neşir olur.
#muharrem önceden güneşe göre oruç açılırdı sahur falan olmaz yeme içme sınırlı idi iftar diye bir kelime geçmezdi iyice sünni dine uydular alevi kızılbaşlar yakında top da patlatılır kiminle gezersen ona benzersiniz,1,dini,avşar alevi türkmenlerinin anadolu ve suriye geçmişi büyük sahabe hazreti ali ra bin ebu talib'e ve hatta peygamber muhammed mustafa sav efendimizin hendek muharebesine dek dayanır. hz muhammed aleyhisselam hendek muharebesinde ilk kez bir türk ailesiyle haşir neşir olur. [SEP] #muharrem önceden güneşe göre oruç açılırdı sahur falan olmaz yeme içme sınırlı idi iftar diye bir kelime geçmezdi iyice sünni dine uydular alevi kızılbaşlar yakında top da patlatılır kiminle gezersen ona benzersiniz
sözde alevi arkadaşlarım her zaman gösterdiğiniz duyarın üçte birini tutulan oruçlara da saygı duyup tükettiğiniz alkollü içeceklerin fotoğraflarını paylaşmazsanız mı :),1,dini,#muharrem önceden güneşe göre oruç açılırdı sahur falan olmaz yeme içme sınırlı idi iftar diye bir kelime geçmezdi iyice sünni dine uydular alevi kızılbaşlar yakında top da patlatılır kiminle gezersen ona benzersiniz [SEP] sözde alevi arkadaşlarım her zaman gösterdiğiniz duyarın üçte birini tutulan oruçlara da saygı duyup tükettiğiniz alkollü içeceklerin fotoğraflarını paylaşmazsanız mı :)
1 canan kaftancıoğlu bir şeyler demiş diye hainlik ediyor yanlış yapıyor yok öyle şey la diye kızıyorlar. la olum ben türk ve alevi kökenliyim atalarım yakın zaman büyüklerim ve ben sizlerin insanlarıma ve bana neler yapıldığını biliyorsunuz.,2,,sözde alevi arkadaşlarım her zaman gösterdiğiniz duyarın üçte birini tutulan oruçlara da saygı duyup tükettiğiniz alkollü içeceklerin fotoğraflarını paylaşmazsanız mı :) [SEP] 1 canan kaftancıoğlu bir şeyler demiş diye hainlik ediyor yanlış yapıyor yok öyle şey la diye kızıyorlar. la olum ben türk ve alevi kökenliyim atalarım yakın zaman büyüklerim ve ben sizlerin insanlarıma ve bana neler yapıldığını biliyorsunuz.
ailevi sorunları her defasında alevi sorunları diye okumam,2,,1 canan kaftancıoğlu bir şeyler demiş diye hainlik ediyor yanlış yapıyor yok öyle şey la diye kızıyorlar. la olum ben türk ve alevi kökenliyim atalarım yakın zaman büyüklerim ve ben sizlerin insanlarıma ve bana neler yapıldığını biliyorsunuz. [SEP] ailevi sorunları her defasında alevi sorunları diye okumam
dara çekmek bir alevi ritüelidir. kişiyi eleştirmek cezasını belirlemek için yapılır. dar ağacı da buradan gelir. ankara'yı dar etmek. ankara'yı dara çekmek isteyenlere duyurulur. yavaş gelin biraz,2,,ailevi sorunları her defasında alevi sorunları diye okumam [SEP] dara çekmek bir alevi ritüelidir. kişiyi eleştirmek cezasını belirlemek için yapılır. dar ağacı da buradan gelir. ankara'yı dar etmek. ankara'yı dara çekmek isteyenlere duyurulur. yavaş gelin biraz
bu kapılara sınırlara durduk yere bakılmaz ilk casusluk davasında ki alevi kimlikler üzerine yazılımlar ile baktım çünkü türk kadını konu askeri polisi olduğunda seks işçisi de olsa bu denli rahat ifadeler vermez sonra ermeni soykırım dosyası ve canlı bombalar nedeniyle baktım,2,,dara çekmek bir alevi ritüelidir. kişiyi eleştirmek cezasını belirlemek için yapılır. dar ağacı da buradan gelir. ankara'yı dar etmek. ankara'yı dara çekmek isteyenlere duyurulur. yavaş gelin biraz [SEP] bu kapılara sınırlara durduk yere bakılmaz ilk casusluk davasında ki alevi kimlikler üzerine yazılımlar ile baktım çünkü türk kadını konu askeri polisi olduğunda seks işçisi de olsa bu denli rahat ifadeler vermez sonra ermeni soykırım dosyası ve canlı bombalar nedeniyle baktım
mum alevi kadar titrek bir umuda sarılarak sabahı zor ettiğim geceden sonra senin için hiçbir şey oluşum gerçeğini cebime koydum ayaz bir eylül sabahında evime döndüm...,2,,bu kapılara sınırlara durduk yere bakılmaz ilk casusluk davasında ki alevi kimlikler üzerine yazılımlar ile baktım çünkü türk kadını konu askeri polisi olduğunda seks işçisi de olsa bu denli rahat ifadeler vermez sonra ermeni soykırım dosyası ve canlı bombalar nedeniyle baktım [SEP] mum alevi kadar titrek bir umuda sarılarak sabahı zor ettiğim geceden sonra senin için hiçbir şey oluşum gerçeğini cebime koydum ayaz bir eylül sabahında evime döndüm...
kimsenin ne siyasi ne dini görüşüne saygısızlık yapmadım düşüncelerimi söyledim ideolojimi belli ettim . ailemden aldığım terbiye buna hiç izin vermedi. ramazan'da içki içilmez deyip alevi vatandaşların tuttuğu oruçlarda kadeh kaldıranlara aleviler de dahil,2,,mum alevi kadar titrek bir umuda sarılarak sabahı zor ettiğim geceden sonra senin için hiçbir şey oluşum gerçeğini cebime koydum ayaz bir eylül sabahında evime döndüm... [SEP] kimsenin ne siyasi ne dini görüşüne saygısızlık yapmadım düşüncelerimi söyledim ideolojimi belli ettim . ailemden aldığım terbiye buna hiç izin vermedi. ramazan'da içki içilmez deyip alevi vatandaşların tuttuğu oruçlarda kadeh kaldıranlara aleviler de dahil
hayatın tadını en çok yıkılırken alıyorum. alev alevi ancak güçlendirir. kalbimde kal.,2,,kimsenin ne siyasi ne dini görüşüne saygısızlık yapmadım düşüncelerimi söyledim ideolojimi belli ettim . ailemden aldığım terbiye buna hiç izin vermedi. ramazan'da içki içilmez deyip alevi vatandaşların tuttuğu oruçlarda kadeh kaldıranlara aleviler de dahil [SEP] hayatın tadını en çok yıkılırken alıyorum. alev alevi ancak güçlendirir. kalbimde kal.
"rejimin böyle bir iç operasyona gideceğini zannedenler vardı. rejim öyle yönetmez. bunlar egemenler arası paylaşım itişmeleridir. devlet terörünün hedefi sadece 3 tarihsel hareket ve onların ittifak zeminleridir işçi alevi ve kürt hareketi. bunların ""locus""u da bugün hdp dir.",2,,"hayatın tadını en çok yıkılırken alıyorum. alev alevi ancak güçlendirir. kalbimde kal. [SEP] rejimin böyle bir iç operasyona gideceğini zannedenler vardı. rejim öyle yönetmez. bunlar egemenler arası paylaşım itişmeleridir. devlet terörünün hedefi sadece 3 tarihsel hareket ve onların ittifak zeminleridir işçi alevi ve kürt hareketi. bunların ""locus""u da bugün hdp dir."
ileri kitap şilan geçgel yazdı devletin sakıncalılar listesinde alevi kürtler,2,,"rejimin böyle bir iç operasyona gideceğini zannedenler vardı. rejim öyle yönetmez. bunlar egemenler arası paylaşım itişmeleridir. devlet terörünün hedefi sadece 3 tarihsel hareket ve onların ittifak zeminleridir işçi alevi ve kürt hareketi. bunların ""locus""u da bugün hdp dir. [SEP] ileri kitap şilan geçgel yazdı devletin sakıncalılar listesinde alevi kürtler"
alevi kültür derneklerinde kayyum tartışması!,2,,ileri kitap şilan geçgel yazdı devletin sakıncalılar listesinde alevi kürtler [SEP] alevi kültür derneklerinde kayyum tartışması!
#susamam sosyal medyada saman alevi.,2,,alevi kültür derneklerinde kayyum tartışması! [SEP] #susamam sosyal medyada saman alevi.
dağıstanlı müslüman dövüşçü #habib amerikalı #dustinpoirer'i yendiği maç sonrası tüm dünyaya sportmenlik dersi verdi.,2,,#susamam sosyal medyada saman alevi. [SEP] dağıstanlı müslüman dövüşçü #habib amerikalı #dustinpoirer'i yendiği maç sonrası tüm dünyaya sportmenlik dersi verdi.
