Tweet,Etiket,Alt Etiket,CONTEXT_INPUT
canan kaftancıoğlu kararı kürt'ün siyaset yapmasını destekleyenlere verilmiş bir yapamazsınız mesajıdır! tuhafiye özel'de ve neden yalnız bırakılmaması gerektiğini konuştu #canankaftancıoğluyalnızdeğildir,2,,biz kürdüz diyarbakırlıyız. biz türklerle kardeşiz. bu bir reklam ve şov değil. burada yüreği yanan anneler var. bu annelere kim elinden nasıl geliyorsa destek olmalıdır yalnız bırakılmamalıdır. kimi çayını alıp gelsin kimi selamını getirsin #annelerdireniyor [SEP] canan kaftancıoğlu kararı kürt'ün siyaset yapmasını destekleyenlere verilmiş bir yapamazsınız mesajıdır! tuhafiye özel'de ve neden yalnız bırakılmaması gerektiğini konuştu #canankaftancıoğluyalnızdeğildir
modern cemaatlerin ekonomik siyasi gücünü de konuşun. buna kürt ve alevi cemaatleri de dahil. onlara demokrasi diğerlerine zapturapt. insanları ötekileştirmeyin. #türkiyeninnabzı,2,,canan kaftancıoğlu kararı kürt'ün siyaset yapmasını destekleyenlere verilmiş bir yapamazsınız mesajıdır! tuhafiye özel'de ve neden yalnız bırakılmaması gerektiğini konuştu #canankaftancıoğluyalnızdeğildir [SEP] modern cemaatlerin ekonomik siyasi gücünü de konuşun. buna kürt ve alevi cemaatleri de dahil. onlara demokrasi diğerlerine zapturapt. insanları ötekileştirmeyin. #türkiyeninnabzı
en sevdiğim şal markasının sahibi reisçi kürt çıktı... sen sabır ver yarabbim kimlere para kazandırmışız,1,etnik,modern cemaatlerin ekonomik siyasi gücünü de konuşun. buna kürt ve alevi cemaatleri de dahil. onlara demokrasi diğerlerine zapturapt. insanları ötekileştirmeyin. #türkiyeninnabzı [SEP] en sevdiğim şal markasının sahibi reisçi kürt çıktı... sen sabır ver yarabbim kimlere para kazandırmışız
bu idealde tabiki kürt hareketi olacak olmayacak tek şey militarist baskıcı faşizan bakış,2,,en sevdiğim şal markasının sahibi reisçi kürt çıktı... sen sabır ver yarabbim kimlere para kazandırmışız [SEP] bu idealde tabiki kürt hareketi olacak olmayacak tek şey militarist baskıcı faşizan bakış
bu kürtler için de geçerli mi ?,2,,bu idealde tabiki kürt hareketi olacak olmayacak tek şey militarist baskıcı faşizan bakış [SEP] bu kürtler için de geçerli mi ?
soylu'ya soruyorum. akp'ye oy verenler kürt vatandaşı chp'ye oy verenler pkk'lı allah senin cezanı versin.,0,,bu kürtler için de geçerli mi ? [SEP] soylu'ya soruyorum. akp'ye oy verenler kürt vatandaşı chp'ye oy verenler pkk'lı allah senin cezanı versin.
fakir kürt çocukları dağlara ölüme hdp'nin baronlarının çocukları fransa'ya eğitime,1,siyasi,soylu'ya soruyorum. akp'ye oy verenler kürt vatandaşı chp'ye oy verenler pkk'lı allah senin cezanı versin. [SEP] fakir kürt çocukları dağlara ölüme hdp'nin baronlarının çocukları fransa'ya eğitime
bu anaların feryadını duymayan pkk terör örgütüdür diyemeyen pkk destekçisi siyasi partilerle kol kola yürüyenler televizyonlara çıkıp boş boş konuşmasınlar. çok basitsiniz türkiye'de kürt sorunu yoktur. türkiye'de pkk sorunu vardır. pkk bir terör örgütüdür. #şerefsizler,0,,fakir kürt çocukları dağlara ölüme hdp'nin baronlarının çocukları fransa'ya eğitime [SEP] bu anaların feryadını duymayan pkk terör örgütüdür diyemeyen pkk destekçisi siyasi partilerle kol kola yürüyenler televizyonlara çıkıp boş boş konuşmasınlar. çok basitsiniz türkiye'de kürt sorunu yoktur. türkiye'de pkk sorunu vardır. pkk bir terör örgütüdür. #şerefsizler
cüneyt özdemir cevapsız bırakılacak bir kaç soru sordu. neden susuyorsunuz. ya kürtlere olan nefretten ya da hdp'ye olan sevgiden. hakkari'de van'da şırnak'ta diyarbakır'da binlerce çocuk kaçırıldı hepsine sustunuz hdp pkk,1,siyasi,bu anaların feryadını duymayan pkk terör örgütüdür diyemeyen pkk destekçisi siyasi partilerle kol kola yürüyenler televizyonlara çıkıp boş boş konuşmasınlar. çok basitsiniz türkiye'de kürt sorunu yoktur. türkiye'de pkk sorunu vardır. pkk bir terör örgütüdür. #şerefsizler [SEP] cüneyt özdemir cevapsız bırakılacak bir kaç soru sordu. neden susuyorsunuz. ya kürtlere olan nefretten ya da hdp'ye olan sevgiden. hakkari'de van'da şırnak'ta diyarbakır'da binlerce çocuk kaçırıldı hepsine sustunuz hdp pkk
biz anaların isyanına değil anaların devlet tarafından yanlış adrese yönlendirilmesine itiraz ediyoruz. o anaların evlat kaygısının müsebbibi dolmabahçe mutabakatını tanımayanlardır. o analara hesap vermesi gerekenler kürdün iradesine kayyım atayanlardır. vicdansız,2,,cüneyt özdemir cevapsız bırakılacak bir kaç soru sordu. neden susuyorsunuz. ya kürtlere olan nefretten ya da hdp'ye olan sevgiden. hakkari'de van'da şırnak'ta diyarbakır'da binlerce çocuk kaçırıldı hepsine sustunuz hdp pkk [SEP] biz anaların isyanına değil anaların devlet tarafından yanlış adrese yönlendirilmesine itiraz ediyoruz. o anaların evlat kaygısının müsebbibi dolmabahçe mutabakatını tanımayanlardır. o analara hesap vermesi gerekenler kürdün iradesine kayyım atayanlardır. vicdansız
batı haçlı seferleri düzenliyor bizim saflar hala abd kürt haklarını savunuyor iddiasında,2,,biz anaların isyanına değil anaların devlet tarafından yanlış adrese yönlendirilmesine itiraz ediyoruz. o anaların evlat kaygısının müsebbibi dolmabahçe mutabakatını tanımayanlardır. o analara hesap vermesi gerekenler kürdün iradesine kayyım atayanlardır. vicdansız [SEP] batı haçlı seferleri düzenliyor bizim saflar hala abd kürt haklarını savunuyor iddiasında
özerklik ya da federasyon kürt kardeşlerimizin söylemi olamaz lgbti'ye değil annelere destek,1,cinsiyetçi,batı haçlı seferleri düzenliyor bizim saflar hala abd kürt haklarını savunuyor iddiasında [SEP] özerklik ya da federasyon kürt kardeşlerimizin söylemi olamaz lgbti'ye değil annelere destek
pkk ateist bir örgüttür ve kürt halkının dostu değildir lgbti'ye değil annelere destek,1,"dini,cinsiyetçi",özerklik ya da federasyon kürt kardeşlerimizin söylemi olamaz lgbti'ye değil annelere destek [SEP] pkk ateist bir örgüttür ve kürt halkının dostu değildir lgbti'ye değil annelere destek
batı derin devletleri kürt halkının dostu değildir lgbti'ye değil annelere destek,1,cinsiyetçi,pkk ateist bir örgüttür ve kürt halkının dostu değildir lgbti'ye değil annelere destek [SEP] batı derin devletleri kürt halkının dostu değildir lgbti'ye değil annelere destek
kürt kardeşlerimiz nur pkk pislik kahbe kalleştir lgbti'ye değil annelere destek,1,cinsiyetçi,batı derin devletleri kürt halkının dostu değildir lgbti'ye değil annelere destek [SEP] kürt kardeşlerimiz nur pkk pislik kahbe kalleştir lgbti'ye değil annelere destek
bizim itirazımız devleti yönetenler açılım yapınca demokrasi geliyor diyenlerin muhalefet kürt sorunu vardır diyince hain ilan edilmesine. bizim itirazımız dünün akil adamlarının bugün chp terörist demesine,2,,kürt kardeşlerimiz nur pkk pislik kahbe kalleştir lgbti'ye değil annelere destek [SEP] bizim itirazımız devleti yönetenler açılım yapınca demokrasi geliyor diyenlerin muhalefet kürt sorunu vardır diyince hain ilan edilmesine. bizim itirazımız dünün akil adamlarının bugün chp terörist demesine
"çocuklarının dağa kaçırıldığını iddia eden diyarbakır annelerinin hdp il binası önünde başlattığı oturma eylem devam ediyor. ""bunlar kürt değil bunlar gavur"" #cumartesi #hdp #diyarbakır #annelerdireniyor #annelerindirenisi #annelerleberaberizyasen #hdpkapatılsın",1,dini,"bizim itirazımız devleti yönetenler açılım yapınca demokrasi geliyor diyenlerin muhalefet kürt sorunu vardır diyince hain ilan edilmesine. bizim itirazımız dünün akil adamlarının bugün chp terörist demesine [SEP] çocuklarının dağa kaçırıldığını iddia eden diyarbakır annelerinin hdp il binası önünde başlattığı oturma eylem devam ediyor. ""bunlar kürt değil bunlar gavur"" #cumartesi #hdp #diyarbakır #annelerdireniyor #annelerindirenisi #annelerleberaberizyasen #hdpkapatılsın"
#davamızınpeşindeyiz #sanatçılardiyarbakıra bir kürt olarak çocuğu kürt anaları hacire ana gibi eyleme davet ediyorum.,2,,"çocuklarının dağa kaçırıldığını iddia eden diyarbakır annelerinin hdp il binası önünde başlattığı oturma eylem devam ediyor. ""bunlar kürt değil bunlar gavur"" #cumartesi #hdp #diyarbakır #annelerdireniyor #annelerindirenisi #annelerleberaberizyasen #hdpkapatılsın [SEP] #davamızınpeşindeyiz #sanatçılardiyarbakıra bir kürt olarak çocuğu kürt anaları hacire ana gibi eyleme davet ediyorum."
#davamızınpeşindeyiz #sanatçılardiyarbakıra 81 ilde bütün pkk hdp il başkanlık binalarının önünde kürt analar eylem yapmalıdır. pkk hdp 81 ilde kepenk indirmek zorunda kalmalıdır.,1,siyasi,#davamızınpeşindeyiz #sanatçılardiyarbakıra bir kürt olarak çocuğu kürt anaları hacire ana gibi eyleme davet ediyorum. [SEP] #davamızınpeşindeyiz #sanatçılardiyarbakıra 81 ilde bütün pkk hdp il başkanlık binalarının önünde kürt analar eylem yapmalıdır. pkk hdp 81 ilde kepenk indirmek zorunda kalmalıdır.
"#davamızınpeşindeyiz #sanatçılardiyarbakıra yiğit analara destek olalım kürt selam anadolu hareketi genel başkanı galip ilhaner ise şunları ifade etti ""hacire akar ve fevziye çetinkaya gibi anaların sayısı artmalı.""",2,,"#davamızınpeşindeyiz #sanatçılardiyarbakıra 81 ilde bütün pkk hdp il başkanlık binalarının önünde kürt analar eylem yapmalıdır. pkk hdp 81 ilde kepenk indirmek zorunda kalmalıdır. [SEP] #davamızınpeşindeyiz #sanatçılardiyarbakıra yiğit analara destek olalım kürt selam anadolu hareketi genel başkanı galip ilhaner ise şunları ifade etti ""hacire akar ve fevziye çetinkaya gibi anaların sayısı artmalı."""
"#davamızınpeşindeyiz #sanatçılardiyarbakıra akit'e konuşan kürt siyasetçiler ""kürt analar hdp pkk'yı 81 ilde kapatmaya hazırlanıyor""",1,siyasi,"#davamızınpeşindeyiz #sanatçılardiyarbakıra yiğit analara destek olalım kürt selam anadolu hareketi genel başkanı galip ilhaner ise şunları ifade etti ""hacire akar ve fevziye çetinkaya gibi anaların sayısı artmalı."" [SEP] #davamızınpeşindeyiz #sanatçılardiyarbakıra akit'e konuşan kürt siyasetçiler ""kürt analar hdp pkk'yı 81 ilde kapatmaya hazırlanıyor"""
"kürt halkının pkk ile zerre bağı olmadığını... biz sürekli savaş halinde olalım diye pkk'yı kurup besleyen bitmemesi için yıllardır ""dış mihrakların"" milyarlarca dolar harcadığını... harcadığı parayı da bize silah ve mühimmat satarak geri aldığını... anladığımız gün büyürüz...",2,,"#davamızınpeşindeyiz #sanatçılardiyarbakıra akit'e konuşan kürt siyasetçiler ""kürt analar hdp pkk'yı 81 ilde kapatmaya hazırlanıyor"" [SEP] kürt halkının pkk ile zerre bağı olmadığını... biz sürekli savaş halinde olalım diye pkk'yı kurup besleyen bitmemesi için yıllardır ""dış mihrakların"" milyarlarca dolar harcadığını... harcadığı parayı da bize silah ve mühimmat satarak geri aldığını... anladığımız gün büyürüz..."
bunlar da trenin son vagonlarına yetişenler görüntüde kemalistiz antiemperyalistiz ümmetiz kürt türk nasyonalistiz ifadesiz ruhsuz soysuz maskeler gerçekte kalpsiz globalist ibneler #susamam #annelerdireniyor,1,cinsiyetçi,"kürt halkının pkk ile zerre bağı olmadığını... biz sürekli savaş halinde olalım diye pkk'yı kurup besleyen bitmemesi için yıllardır ""dış mihrakların"" milyarlarca dolar harcadığını... harcadığı parayı da bize silah ve mühimmat satarak geri aldığını... anladığımız gün büyürüz... [SEP] bunlar da trenin son vagonlarına yetişenler görüntüde kemalistiz antiemperyalistiz ümmetiz kürt türk nasyonalistiz ifadesiz ruhsuz soysuz maskeler gerçekte kalpsiz globalist ibneler #susamam #annelerdireniyor"
hani kürt sorunu diyoruz da saatlerce eveleyip konuşuyoruz ya... işte gerçek kürt sorunu budur! kürtler senelerdir terör örgütlerinin zulmünü yaşıyor.,2,,bunlar da trenin son vagonlarına yetişenler görüntüde kemalistiz antiemperyalistiz ümmetiz kürt türk nasyonalistiz ifadesiz ruhsuz soysuz maskeler gerçekte kalpsiz globalist ibneler #susamam #annelerdireniyor [SEP] hani kürt sorunu diyoruz da saatlerce eveleyip konuşuyoruz ya... işte gerçek kürt sorunu budur! kürtler senelerdir terör örgütlerinin zulmünü yaşıyor.
işte kürt halkının çocukları...,2,,hani kürt sorunu diyoruz da saatlerce eveleyip konuşuyoruz ya... işte gerçek kürt sorunu budur! kürtler senelerdir terör örgütlerinin zulmünü yaşıyor. [SEP] işte kürt halkının çocukları...
cemile bin ailesi ve devlet tarafından öldürülen kürt çocukların aileleri barış anneleri ve gerçek kürt anneleri hdp'nin önünde oturmaya gitsinler bakalım trt ahaber atv trt kurdi mikrofonları orada yayın yapmaya devam ederler mi?,2,,işte kürt halkının çocukları... [SEP] cemile bin ailesi ve devlet tarafından öldürülen kürt çocukların aileleri barış anneleri ve gerçek kürt anneleri hdp'nin önünde oturmaya gitsinler bakalım trt ahaber atv trt kurdi mikrofonları orada yayın yapmaya devam ederler mi?
anaların feryadı hdp ve pkk yı bitirir. 81 ilde bütün pkk hdp il başkanlık binalarının önünde kürt analar eylem yapmalıdır. pkk hdp 81 ilde kepenk indirmek zorunda kalmalıdır. bir kürt olarak çocuğu kürt anaları hacire ana gibi eyleme davet ediyorum.,1,siyasi,cemile bin ailesi ve devlet tarafından öldürülen kürt çocukların aileleri barış anneleri ve gerçek kürt anneleri hdp'nin önünde oturmaya gitsinler bakalım trt ahaber atv trt kurdi mikrofonları orada yayın yapmaya devam ederler mi? [SEP] anaların feryadı hdp ve pkk yı bitirir. 81 ilde bütün pkk hdp il başkanlık binalarının önünde kürt analar eylem yapmalıdır. pkk hdp 81 ilde kepenk indirmek zorunda kalmalıdır. bir kürt olarak çocuğu kürt anaları hacire ana gibi eyleme davet ediyorum.
"anaların feryadı hdp ve pkk'yı bitirir yiğit analara destek olalım kürt selam anadolu hareketi genel başkanı galip ilhaner ise şunları ifade etti ""hacire akar ve fevziye çetinkaya gibi anaların sayısı artmalı.""",1,siyasi,"anaların feryadı hdp ve pkk yı bitirir. 81 ilde bütün pkk hdp il başkanlık binalarının önünde kürt analar eylem yapmalıdır. pkk hdp 81 ilde kepenk indirmek zorunda kalmalıdır. bir kürt olarak çocuğu kürt anaları hacire ana gibi eyleme davet ediyorum. [SEP] anaların feryadı hdp ve pkk'yı bitirir yiğit analara destek olalım kürt selam anadolu hareketi genel başkanı galip ilhaner ise şunları ifade etti ""hacire akar ve fevziye çetinkaya gibi anaların sayısı artmalı."""
"kürt selam anadolu hareketi genel başkanı galip ilhaner ise şunları ifade etti ""hacire akar ve fevziye çetinkaya gibi anaların sayısı artmalı. 81 ilde bütün pkk hdp il başkanlık binalarının önünde kürt analar eylem yapmalıdır.""",1,siyasi,"anaların feryadı hdp ve pkk'yı bitirir yiğit analara destek olalım kürt selam anadolu hareketi genel başkanı galip ilhaner ise şunları ifade etti ""hacire akar ve fevziye çetinkaya gibi anaların sayısı artmalı."" [SEP] kürt selam anadolu hareketi genel başkanı galip ilhaner ise şunları ifade etti ""hacire akar ve fevziye çetinkaya gibi anaların sayısı artmalı. 81 ilde bütün pkk hdp il başkanlık binalarının önünde kürt analar eylem yapmalıdır."""
biz kürtlerin sabah sporu... sodire xer rojbaş günaydın,2,,"kürt selam anadolu hareketi genel başkanı galip ilhaner ise şunları ifade etti ""hacire akar ve fevziye çetinkaya gibi anaların sayısı artmalı. 81 ilde bütün pkk hdp il başkanlık binalarının önünde kürt analar eylem yapmalıdır."" [SEP] biz kürtlerin sabah sporu... sodire xer rojbaş günaydın"
"anaların feryadı hdp ve pkk'yı bitirir. akit'e konuşan kürt siyasetçiler ""kürt analar hdp pkk'yı 81 ilde kapatmaya hazırlanıyor"" dedi.",1,siyasi,"biz kürtlerin sabah sporu... sodire xer rojbaş günaydın [SEP] anaların feryadı hdp ve pkk'yı bitirir. akit'e konuşan kürt siyasetçiler ""kürt analar hdp pkk'yı 81 ilde kapatmaya hazırlanıyor"" dedi."
en tatlı sabahlar kürt böreğiyle başlar hepinize günaydın çekiyorum,2,,"anaların feryadı hdp ve pkk'yı bitirir. akit'e konuşan kürt siyasetçiler ""kürt analar hdp pkk'yı 81 ilde kapatmaya hazırlanıyor"" dedi. [SEP] en tatlı sabahlar kürt böreğiyle başlar hepinize günaydın çekiyorum"
türkiye'de pkk'ya yataklık eden pkk'yla arasına mesafe koymayan kürt partileri kaybeder fetö'ye mesafe koyamayan da dini siyasete alet eden de kaybeder. bu hep böyle olmuştur. terör yapar hukuksuz karar verir adalete uymaz parayla insan tutar ama başaramaz sonunda yok olurlar.,2,,en tatlı sabahlar kürt böreğiyle başlar hepinize günaydın çekiyorum [SEP] türkiye'de pkk'ya yataklık eden pkk'yla arasına mesafe koymayan kürt partileri kaybeder fetö'ye mesafe koyamayan da dini siyasete alet eden de kaybeder. bu hep böyle olmuştur. terör yapar hukuksuz karar verir adalete uymaz parayla insan tutar ama başaramaz sonunda yok olurlar.
"şanlı türk ordusu gazi m. k. atatürk'ün ""ordular ilk hedefiniz akdeniz'dir ileri!"" emriyle 9 eylül 1922'de izmir'e türk bayrağını çekmiştir. başta ebedi başkomutanımız gazi mustafa kemal atatürk olmak üzere tüm şehitlerimizi ve gazilerimizi saygı minnet ve rahmetle anıyoruz.",2,,"türkiye'de pkk'ya yataklık eden pkk'yla arasına mesafe koymayan kürt partileri kaybeder fetö'ye mesafe koyamayan da dini siyasete alet eden de kaybeder. bu hep böyle olmuştur. terör yapar hukuksuz karar verir adalete uymaz parayla insan tutar ama başaramaz sonunda yok olurlar. [SEP] şanlı türk ordusu gazi m. k. atatürk'ün ""ordular ilk hedefiniz akdeniz'dir ileri!"" emriyle 9 eylül 1922'de izmir'e türk bayrağını çekmiştir. başta ebedi başkomutanımız gazi mustafa kemal atatürk olmak üzere tüm şehitlerimizi ve gazilerimizi saygı minnet ve rahmetle anıyoruz."
"haddimize değil ama ""türk kadınına fırsat verilince"" cümlesindeki tepeden bakan tavrın kabulü mümkün değildir. türk kadını kendi fırsatını da kendi başarısını da kendi yaratacak kudrettedir. kimse türk kadınına fırsat verici olamaz bu topraklarda! #fileninsultanlari",2,,"şanlı türk ordusu gazi m. k. atatürk'ün ""ordular ilk hedefiniz akdeniz'dir ileri!"" emriyle 9 eylül 1922'de izmir'e türk bayrağını çekmiştir. başta ebedi başkomutanımız gazi mustafa kemal atatürk olmak üzere tüm şehitlerimizi ve gazilerimizi saygı minnet ve rahmetle anıyoruz. [SEP] haddimize değil ama ""türk kadınına fırsat verilince"" cümlesindeki tepeden bakan tavrın kabulü mümkün değildir. türk kadını kendi fırsatını da kendi başarısını da kendi yaratacak kudrettedir. kimse türk kadınına fırsat verici olamaz bu topraklarda! #fileninsultanlari"
#9eylül türk halkının bağımsızlığa giden onurlu yolculuğunda düşman işgaline son verilmesinin ve al bayrağımızın özgürce dalgalanmasının tarihi günlerindendir. kurtuluş coşkusunu yaşayan güzel #izmir'i selamlıyor izmir'in düşman işgalinden kurtuluşunun yıldönümünü kutluyorum.,2,,"haddimize değil ama ""türk kadınına fırsat verilince"" cümlesindeki tepeden bakan tavrın kabulü mümkün değildir. türk kadını kendi fırsatını da kendi başarısını da kendi yaratacak kudrettedir. kimse türk kadınına fırsat verici olamaz bu topraklarda! #fileninsultanlari [SEP] #9eylül türk halkının bağımsızlığa giden onurlu yolculuğunda düşman işgaline son verilmesinin ve al bayrağımızın özgürce dalgalanmasının tarihi günlerindendir. kurtuluş coşkusunu yaşayan güzel #izmir'i selamlıyor izmir'in düşman işgalinden kurtuluşunun yıldönümünü kutluyorum."
30 yaşımda ülkenin varlığını öğrenerek sanki 2 kere müjde almış gibi oldum. bu da benim cahilliğim olsun :) müjdeli haber! türk vatandaşları kapıda vizeyle girebilecekler aracılığıyla,2,,#9eylül türk halkının bağımsızlığa giden onurlu yolculuğunda düşman işgaline son verilmesinin ve al bayrağımızın özgürce dalgalanmasının tarihi günlerindendir. kurtuluş coşkusunu yaşayan güzel #izmir'i selamlıyor izmir'in düşman işgalinden kurtuluşunun yıldönümünü kutluyorum. [SEP] 30 yaşımda ülkenin varlığını öğrenerek sanki 2 kere müjde almış gibi oldum. bu da benim cahilliğim olsun :) müjdeli haber! türk vatandaşları kapıda vizeyle girebilecekler aracılığıyla
"torinolu şaban talimat ve tüyoları almış. ""eksiklerini saklama doğal ol samimi görün türk insanı böyle şeyleri sever hoş görür sevmeyeni de yavaş yavaş sevmeye başlar cia projesi fetö'ye hizmete devam ettiğini unutur seni bağrına basar türkiye'ye dönmen kolaylaşır"" demişler",2,,"30 yaşımda ülkenin varlığını öğrenerek sanki 2 kere müjde almış gibi oldum. bu da benim cahilliğim olsun :) müjdeli haber! türk vatandaşları kapıda vizeyle girebilecekler aracılığıyla [SEP] torinolu şaban talimat ve tüyoları almış. ""eksiklerini saklama doğal ol samimi görün türk insanı böyle şeyleri sever hoş görür sevmeyeni de yavaş yavaş sevmeye başlar cia projesi fetö'ye hizmete devam ettiğini unutur seni bağrına basar türkiye'ye dönmen kolaylaşır"" demişler"
emre mor türk güzelin peşine düştü... mesajları ifşa oldu,2,,"torinolu şaban talimat ve tüyoları almış. ""eksiklerini saklama doğal ol samimi görün türk insanı böyle şeyleri sever hoş görür sevmeyeni de yavaş yavaş sevmeye başlar cia projesi fetö'ye hizmete devam ettiğini unutur seni bağrına basar türkiye'ye dönmen kolaylaşır"" demişler [SEP] emre mor türk güzelin peşine düştü... mesajları ifşa oldu"
seyahat severlere müjde! türk vatandaşları kapıda vizeyle girebilecekler,2,,emre mor türk güzelin peşine düştü... mesajları ifşa oldu [SEP] seyahat severlere müjde! türk vatandaşları kapıda vizeyle girebilecekler
türk sinemasının emektar ve güler yüzlü oyuncusu süleyman turan 84 yaşında hayatını kaybetti. allah rahmet eylesin.,2,,seyahat severlere müjde! türk vatandaşları kapıda vizeyle girebilecekler [SEP] türk sinemasının emektar ve güler yüzlü oyuncusu süleyman turan 84 yaşında hayatını kaybetti. allah rahmet eylesin.
arkadaş 10 bin yıldır kurduğum imparatorluk ve devletlerimi ben kurdum ben yıktım. yeniden ben kurarım. ama hiç bir zaman türk'ten başkasına bu şansı vermedim vermeyeceğim. bu nedenle türkiye cumhuriyeti'ni yıkmanıza da izin vermeyeceğim.,2,,türk sinemasının emektar ve güler yüzlü oyuncusu süleyman turan 84 yaşında hayatını kaybetti. allah rahmet eylesin. [SEP] arkadaş 10 bin yıldır kurduğum imparatorluk ve devletlerimi ben kurdum ben yıktım. yeniden ben kurarım. ama hiç bir zaman türk'ten başkasına bu şansı vermedim vermeyeceğim. bu nedenle türkiye cumhuriyeti'ni yıkmanıza da izin vermeyeceğim.
gastronomi alanında bir görev daha kuzey kıbrıs türk cumhuriyeti'ni juri olarak indiana'da düzenlenecek olan canlı tv şov juri gastronomi yargıcı olarak uluslararası gastronomi yarışmasında ülkemizi temsil etmek…,2,,arkadaş 10 bin yıldır kurduğum imparatorluk ve devletlerimi ben kurdum ben yıktım. yeniden ben kurarım. ama hiç bir zaman türk'ten başkasına bu şansı vermedim vermeyeceğim. bu nedenle türkiye cumhuriyeti'ni yıkmanıza da izin vermeyeceğim. [SEP] gastronomi alanında bir görev daha kuzey kıbrıs türk cumhuriyeti'ni juri olarak indiana'da düzenlenecek olan canlı tv şov juri gastronomi yargıcı olarak uluslararası gastronomi yarışmasında ülkemizi temsil etmek…
türk sinemasının sevilen isimlerinden süleyman turan'ın vefatını büyük bir üzüntüyle öğrendim. seveni çok bir sanatçımızdı. allah rahmet eylesin.,2,,gastronomi alanında bir görev daha kuzey kıbrıs türk cumhuriyeti'ni juri olarak indiana'da düzenlenecek olan canlı tv şov juri gastronomi yargıcı olarak uluslararası gastronomi yarışmasında ülkemizi temsil etmek… [SEP] türk sinemasının sevilen isimlerinden süleyman turan'ın vefatını büyük bir üzüntüyle öğrendim. seveni çok bir sanatçımızdı. allah rahmet eylesin.
rotterdam'ın yüzde 10'u türk ama şehirde bir tane türkçe tabela bulamazsın.,2,,türk sinemasının sevilen isimlerinden süleyman turan'ın vefatını büyük bir üzüntüyle öğrendim. seveni çok bir sanatçımızdı. allah rahmet eylesin. [SEP] rotterdam'ın yüzde 10'u türk ama şehirde bir tane türkçe tabela bulamazsın.
yer izmir salondaki türk bayrakları sakil müptezel amed hönkürüşlerini ve bunlara alkış tutan sözde yetkilileri seyrediyor...,1,etnik,rotterdam'ın yüzde 10'u türk ama şehirde bir tane türkçe tabela bulamazsın. [SEP] yer izmir salondaki türk bayrakları sakil müptezel amed hönkürüşlerini ve bunlara alkış tutan sözde yetkilileri seyrediyor...
#türk'üm. #atatürkçü'yüm. liyim... beğenmeyen sayfamdan gidebilir. benden bir şey eksilmez. teşekkürler.,2,,yer izmir salondaki türk bayrakları sakil müptezel amed hönkürüşlerini ve bunlara alkış tutan sözde yetkilileri seyrediyor... [SEP] #türk'üm. #atatürkçü'yüm. liyim... beğenmeyen sayfamdan gidebilir. benden bir şey eksilmez. teşekkürler.
