Tweet,Etiket,Alt Etiket,CONTEXT_INPUT
yani çok özel ve basit örneklemek gerekirse var olan herkesin atatürkçü dinibütün ateist laik vs bir arada yaşayabileceğimizi hepimizin kanıksaması ve bu yönde çabalaması toplumsal barışın temel anahtarıdır. ya değilse ayrışma ve iç savaş tehlikesini her zaman yaşayabiliriz.,2,,ben bir türküm düşmanlarım beni katlederken inancıma bakmıyorlar kızılbaş sünni şaman müslüman hristiyanı ateist farketmiyor. hocalı'da karabağ'da doğu türkistan'da kerkük'te afganistan'da türkmen dağında balkanlarda öldürülen benim beni öldürüyorlar çünkü ben türk'üm [SEP] yani çok özel ve basit örneklemek gerekirse var olan herkesin atatürkçü dinibütün ateist laik vs bir arada yaşayabileceğimizi hepimizin kanıksaması ve bu yönde çabalaması toplumsal barışın temel anahtarıdır. ya değilse ayrışma ve iç savaş tehlikesini her zaman yaşayabiliriz.
çevremde akp'ye bakıp dinden soğuyan birçok insan var hatta ateist olanları bile duydum akp'ye bakarak dinden soğumayın kardeşim islamı kurandan öğrenin fikret orman,2,,yani çok özel ve basit örneklemek gerekirse var olan herkesin atatürkçü dinibütün ateist laik vs bir arada yaşayabileceğimizi hepimizin kanıksaması ve bu yönde çabalaması toplumsal barışın temel anahtarıdır. ya değilse ayrışma ve iç savaş tehlikesini her zaman yaşayabiliriz. [SEP] çevremde akp'ye bakıp dinden soğuyan birçok insan var hatta ateist olanları bile duydum akp'ye bakarak dinden soğumayın kardeşim islamı kurandan öğrenin fikret orman
ateist de olsanız gelen maillere bakıp günde bir kere allahım ne salak insanlar var diyorsunuz.,2,,çevremde akp'ye bakıp dinden soğuyan birçok insan var hatta ateist olanları bile duydum akp'ye bakarak dinden soğumayın kardeşim islamı kurandan öğrenin fikret orman [SEP] ateist de olsanız gelen maillere bakıp günde bir kere allahım ne salak insanlar var diyorsunuz.
kurandaki ayetler çelişiyor diyen bir ateist der ki canı melek mi alıyor. allah mı? cevab canı allah alıyor. ama azrail a.s da alıyor. bunu şöyle düşünebiliriz. cumhurbaşkanı onaylamadan başbakan birşey yapamaz. ve bazen cumhur başbakana bazı işleri yaptırır. bu mesele de böyle.,2,,ateist de olsanız gelen maillere bakıp günde bir kere allahım ne salak insanlar var diyorsunuz. [SEP] kurandaki ayetler çelişiyor diyen bir ateist der ki canı melek mi alıyor. allah mı? cevab canı allah alıyor. ama azrail a.s da alıyor. bunu şöyle düşünebiliriz. cumhurbaşkanı onaylamadan başbakan birşey yapamaz. ve bazen cumhur başbakana bazı işleri yaptırır. bu mesele de böyle.
elinde birayla ateist arkadaşı islama çağırma 10/11 kral hareket,2,,kurandaki ayetler çelişiyor diyen bir ateist der ki canı melek mi alıyor. allah mı? cevab canı allah alıyor. ama azrail a.s da alıyor. bunu şöyle düşünebiliriz. cumhurbaşkanı onaylamadan başbakan birşey yapamaz. ve bazen cumhur başbakana bazı işleri yaptırır. bu mesele de böyle. [SEP] elinde birayla ateist arkadaşı islama çağırma 10/11 kral hareket
küçükken müslüman olmama rağmen ateist sanıyorlardı beni orospu çocukları saçım uzun olunca ateist olmuş olmuyorum sizin o gerici beyninizi sikerim anası sikikler,0,,elinde birayla ateist arkadaşı islama çağırma 10/11 kral hareket [SEP] küçükken müslüman olmama rağmen ateist sanıyorlardı beni orospu çocukları saçım uzun olunca ateist olmuş olmuyorum sizin o gerici beyninizi sikerim anası sikikler
ülkenin yarısı dini doğru yaşadığını sanıyor diğer yarısı da ülkenin diğer yarısı yüzünden ateist,2,,küçükken müslüman olmama rağmen ateist sanıyorlardı beni orospu çocukları saçım uzun olunca ateist olmuş olmuyorum sizin o gerici beyninizi sikerim anası sikikler [SEP] ülkenin yarısı dini doğru yaşadığını sanıyor diğer yarısı da ülkenin diğer yarısı yüzünden ateist
allah'ına kurban dediğimiz herkes ateist çıkıyor,2,,ülkenin yarısı dini doğru yaşadığını sanıyor diğer yarısı da ülkenin diğer yarısı yüzünden ateist [SEP] allah'ına kurban dediğimiz herkes ateist çıkıyor
ben çaldım ama ateist olduğum için değil günah olduğu için. muhtaçlara yardım etmedim sevap olduğundan hiç rüşvet almadım ama veren olmadığı için yani kötü olmam için satanist olmama gerek yok insan olmak yetiyor. lagustane laveyan sweatshirt,2,,allah'ına kurban dediğimiz herkes ateist çıkıyor [SEP] ben çaldım ama ateist olduğum için değil günah olduğu için. muhtaçlara yardım etmedim sevap olduğundan hiç rüşvet almadım ama veren olmadığı için yani kötü olmam için satanist olmama gerek yok insan olmak yetiyor. lagustane laveyan sweatshirt
sınıftakilerin benim için düşündükleri kategoriler ateist misin? uzaylı mısın? tiner mi içiyorsun? neden hep gülüyorsun? ay çok tatlısın yanaklarını sıkmak istiyorum hiçbirinin birbiri ile alakası olmaması sanırım kendimi anlamadığım gibi başkası da beni çözememiş,2,,ben çaldım ama ateist olduğum için değil günah olduğu için. muhtaçlara yardım etmedim sevap olduğundan hiç rüşvet almadım ama veren olmadığı için yani kötü olmam için satanist olmama gerek yok insan olmak yetiyor. lagustane laveyan sweatshirt [SEP] sınıftakilerin benim için düşündükleri kategoriler ateist misin? uzaylı mısın? tiner mi içiyorsun? neden hep gülüyorsun? ay çok tatlısın yanaklarını sıkmak istiyorum hiçbirinin birbiri ile alakası olmaması sanırım kendimi anlamadığım gibi başkası da beni çözememiş
2018'de konda'ya göre ateist ve inançsız toplamı %4'müş. yakında alevilerden %5 fazla dinsiz olacak,2,,sınıftakilerin benim için düşündükleri kategoriler ateist misin? uzaylı mısın? tiner mi içiyorsun? neden hep gülüyorsun? ay çok tatlısın yanaklarını sıkmak istiyorum hiçbirinin birbiri ile alakası olmaması sanırım kendimi anlamadığım gibi başkası da beni çözememiş [SEP] 2018'de konda'ya göre ateist ve inançsız toplamı %4'müş. yakında alevilerden %5 fazla dinsiz olacak
türkiye'de gerçek ateist yok,2,,2018'de konda'ya göre ateist ve inançsız toplamı %4'müş. yakında alevilerden %5 fazla dinsiz olacak [SEP] türkiye'de gerçek ateist yok
böyle dini yorumlar yüzünde millet ateist oluyor.,2,,türkiye'de gerçek ateist yok [SEP] böyle dini yorumlar yüzünde millet ateist oluyor.
ateist değil o gizli gizli cumaya gidiyor,2,,böyle dini yorumlar yüzünde millet ateist oluyor. [SEP] ateist değil o gizli gizli cumaya gidiyor
akp iktidarı 17 yılda ülkedeki bütün tarikatları devlete yerleştirerek liselerin tamamını imam hatip yaparak en çok atama ve bütçeyi de diyanet işleri başkanlığına vererek nihayetinde deist sayısını %5000 ateist sayısını %700 artırmayı başarmıştır. onlar konuşur akp yapar!...,2,,ateist değil o gizli gizli cumaya gidiyor [SEP] akp iktidarı 17 yılda ülkedeki bütün tarikatları devlete yerleştirerek liselerin tamamını imam hatip yaparak en çok atama ve bütçeyi de diyanet işleri başkanlığına vererek nihayetinde deist sayısını %5000 ateist sayısını %700 artırmayı başarmıştır. onlar konuşur akp yapar!...
"yanımdaki arkadaş ""ben felsefe okuyorum"" diyor. karşıdaki şahsın ilk söyleyeceği cümle ""sen ateist misin?"" ya felsefe dinle ilgilenmiyor. ilgi olanı düşüncedir. her konuya açıktır. ne güzel demiş descartes düşünüyorum öyleyse varım.",2,,"akp iktidarı 17 yılda ülkedeki bütün tarikatları devlete yerleştirerek liselerin tamamını imam hatip yaparak en çok atama ve bütçeyi de diyanet işleri başkanlığına vererek nihayetinde deist sayısını %5000 ateist sayısını %700 artırmayı başarmıştır. onlar konuşur akp yapar!... [SEP] yanımdaki arkadaş ""ben felsefe okuyorum"" diyor. karşıdaki şahsın ilk söyleyeceği cümle ""sen ateist misin?"" ya felsefe dinle ilgilenmiyor. ilgi olanı düşüncedir. her konuya açıktır. ne güzel demiş descartes düşünüyorum öyleyse varım."
din ile coolluk işlerini ayıramayıp hava olsun diye ateist olan gençlerimize çok üzülüyorum.,2,,"yanımdaki arkadaş ""ben felsefe okuyorum"" diyor. karşıdaki şahsın ilk söyleyeceği cümle ""sen ateist misin?"" ya felsefe dinle ilgilenmiyor. ilgi olanı düşüncedir. her konuya açıktır. ne güzel demiş descartes düşünüyorum öyleyse varım. [SEP] din ile coolluk işlerini ayıramayıp hava olsun diye ateist olan gençlerimize çok üzülüyorum."
çoğu kişi allah'ın varlığına inanmayı müslümanlık zannediyor. yani ateist değilsen müslümansın... hayır değilsin. allah'a teslim olduysan müslümansın. teslimiyet ise onun emir ve yasaklarına! #yanındayızkılıçdaroğlu,2,,din ile coolluk işlerini ayıramayıp hava olsun diye ateist olan gençlerimize çok üzülüyorum. [SEP] çoğu kişi allah'ın varlığına inanmayı müslümanlık zannediyor. yani ateist değilsen müslümansın... hayır değilsin. allah'a teslim olduysan müslümansın. teslimiyet ise onun emir ve yasaklarına! #yanındayızkılıçdaroğlu
eğitim öğretim sistemimiz gözden geçirilmeli ateist bir kuşak yetiştiren bu sistem acilen milli ve manevi değerlerimizi öğreten bir eğitim ve öğretim kadrosu ile pekiştirmelidir.,1,dini,çoğu kişi allah'ın varlığına inanmayı müslümanlık zannediyor. yani ateist değilsen müslümansın... hayır değilsin. allah'a teslim olduysan müslümansın. teslimiyet ise onun emir ve yasaklarına! #yanındayızkılıçdaroğlu [SEP] eğitim öğretim sistemimiz gözden geçirilmeli ateist bir kuşak yetiştiren bu sistem acilen milli ve manevi değerlerimizi öğreten bir eğitim ve öğretim kadrosu ile pekiştirmelidir.
ya muhammed. bak ben ateist değilim. ateizmi hiç savunmadım. müslüman bir ailede doğdum. müslümanca yaşamaya çalıştım. islamı daha iyi ve daha doğru yaşamaya çalıştım. hangisi doğru diye sürekli araştırdım.,2,,eğitim öğretim sistemimiz gözden geçirilmeli ateist bir kuşak yetiştiren bu sistem acilen milli ve manevi değerlerimizi öğreten bir eğitim ve öğretim kadrosu ile pekiştirmelidir. [SEP] ya muhammed. bak ben ateist değilim. ateizmi hiç savunmadım. müslüman bir ailede doğdum. müslümanca yaşamaya çalıştım. islamı daha iyi ve daha doğru yaşamaya çalıştım. hangisi doğru diye sürekli araştırdım.
ünlü ateist yazar profesör richard dawkins'in yapamadığını bütün okulları imam hatipe en çok atama ve bütçeyi diyanet başkanlığına vermesine rağmen 17 yıllık akp iktidarı yapmış ülkede ateist sayısı %700 artmış... onlar konuşur aq partisi yapar!,1,siyasi,ya muhammed. bak ben ateist değilim. ateizmi hiç savunmadım. müslüman bir ailede doğdum. müslümanca yaşamaya çalıştım. islamı daha iyi ve daha doğru yaşamaya çalıştım. hangisi doğru diye sürekli araştırdım. [SEP] ünlü ateist yazar profesör richard dawkins'in yapamadığını bütün okulları imam hatipe en çok atama ve bütçeyi diyanet başkanlığına vermesine rağmen 17 yıllık akp iktidarı yapmış ülkede ateist sayısı %700 artmış... onlar konuşur aq partisi yapar!
dinciler inançsız insan olmaz diyerek kafa bulandırırlar. evet inançsız insan olmaz. her insan ateist bile olsa bir şeylere inanır. tabi bu dinsel anlamda değil. örneğin ben evrende varlığını sürdüren en ilkel varlıklar olduğumuza inanıyorum. bizden fazla gelişmiş ırklar vardır.,2,,ünlü ateist yazar profesör richard dawkins'in yapamadığını bütün okulları imam hatipe en çok atama ve bütçeyi diyanet başkanlığına vermesine rağmen 17 yıllık akp iktidarı yapmış ülkede ateist sayısı %700 artmış... onlar konuşur aq partisi yapar! [SEP] dinciler inançsız insan olmaz diyerek kafa bulandırırlar. evet inançsız insan olmaz. her insan ateist bile olsa bir şeylere inanır. tabi bu dinsel anlamda değil. örneğin ben evrende varlığını sürdüren en ilkel varlıklar olduğumuza inanıyorum. bizden fazla gelişmiş ırklar vardır.
ateist olmamayı müslüman olmak zannedenler var. #sicilibozuk,2,,dinciler inançsız insan olmaz diyerek kafa bulandırırlar. evet inançsız insan olmaz. her insan ateist bile olsa bir şeylere inanır. tabi bu dinsel anlamda değil. örneğin ben evrende varlığını sürdüren en ilkel varlıklar olduğumuza inanıyorum. bizden fazla gelişmiş ırklar vardır. [SEP] ateist olmamayı müslüman olmak zannedenler var. #sicilibozuk
ateist ramazan sizlerle,2,,ateist olmamayı müslüman olmak zannedenler var. #sicilibozuk [SEP] ateist ramazan sizlerle
keşke maraş belediyesi beni de şehirden kovsa başka türlü gidemiyorum. boş yere şehrin ahlakını ve dini bütünlüğünü ateist halimle bozmayayım.,2,,ateist ramazan sizlerle [SEP] keşke maraş belediyesi beni de şehirden kovsa başka türlü gidemiyorum. boş yere şehrin ahlakını ve dini bütünlüğünü ateist halimle bozmayayım.
ah be her sago dinlediğimde kendimi şarkıdan çok neden ateist olduğunu sorgulamaya veriyorum. acı kaybımız olmuş resmen.,1,dini,keşke maraş belediyesi beni de şehirden kovsa başka türlü gidemiyorum. boş yere şehrin ahlakını ve dini bütünlüğünü ateist halimle bozmayayım. [SEP] ah be her sago dinlediğimde kendimi şarkıdan çok neden ateist olduğunu sorgulamaya veriyorum. acı kaybımız olmuş resmen.
siyasal ateizm antiteizm hareketimize ateist cumhuriyeti web sayfamıza gönüllü web tasarımcıları aranıyor. mür. melike myers,2,,ah be her sago dinlediğimde kendimi şarkıdan çok neden ateist olduğunu sorgulamaya veriyorum. acı kaybımız olmuş resmen. [SEP] siyasal ateizm antiteizm hareketimize ateist cumhuriyeti web sayfamıza gönüllü web tasarımcıları aranıyor. mür. melike myers
sonra da insanlar niye ateist oluyormuş senin gibiler yüzünden cübbeli. cübbeli ahmet hoca tuvalet taşının allah ile konuşmasını anlatıyor. ya rabbim ne suçum vardı da beni tuvalet taşı yaptın? sus! 60 yaşını geçip de sakalsız ölene mezar taşı yaparsam daha mı iyi olur?,2,,siyasal ateizm antiteizm hareketimize ateist cumhuriyeti web sayfamıza gönüllü web tasarımcıları aranıyor. mür. melike myers [SEP] sonra da insanlar niye ateist oluyormuş senin gibiler yüzünden cübbeli. cübbeli ahmet hoca tuvalet taşının allah ile konuşmasını anlatıyor. ya rabbim ne suçum vardı da beni tuvalet taşı yaptın? sus! 60 yaşını geçip de sakalsız ölene mezar taşı yaparsam daha mı iyi olur?
bu tür heriflerin islama gram faydası yok bunları dinleyen aklı başında herkes ateist ya da hristiyan olur,2,,sonra da insanlar niye ateist oluyormuş senin gibiler yüzünden cübbeli. cübbeli ahmet hoca tuvalet taşının allah ile konuşmasını anlatıyor. ya rabbim ne suçum vardı da beni tuvalet taşı yaptın? sus! 60 yaşını geçip de sakalsız ölene mezar taşı yaparsam daha mı iyi olur? [SEP] bu tür heriflerin islama gram faydası yok bunları dinleyen aklı başında herkes ateist ya da hristiyan olur
bazı hocalar keşke sussa değil ateist deist oluyor insanlar. 5g'den ses hızına yaklaşan araçlardan bahsederken uçsuz bucaksız çölde deveyle 3 gün yalnız yol mu gidiyoruz? çemberin içinde olmak öyle güzel ki keşke o meftunluğu anlatsanız da kalpler yumuşasa,2,,bu tür heriflerin islama gram faydası yok bunları dinleyen aklı başında herkes ateist ya da hristiyan olur [SEP] bazı hocalar keşke sussa değil ateist deist oluyor insanlar. 5g'den ses hızına yaklaşan araçlardan bahsederken uçsuz bucaksız çölde deveyle 3 gün yalnız yol mu gidiyoruz? çemberin içinde olmak öyle güzel ki keşke o meftunluğu anlatsanız da kalpler yumuşasa
feminist ateist sosyal medya uzmanı la tahzen ile başlayan arapça birşey rte. bir taraf olmayı aşırı huy edinmiş insanlara huy oluyorum,2,,bazı hocalar keşke sussa değil ateist deist oluyor insanlar. 5g'den ses hızına yaklaşan araçlardan bahsederken uçsuz bucaksız çölde deveyle 3 gün yalnız yol mu gidiyoruz? çemberin içinde olmak öyle güzel ki keşke o meftunluğu anlatsanız da kalpler yumuşasa [SEP] feminist ateist sosyal medya uzmanı la tahzen ile başlayan arapça birşey rte. bir taraf olmayı aşırı huy edinmiş insanlara huy oluyorum
bazı sosyalist ateist vatandaşlara bakıyorum da hepsi akp yüzünden dinden çıkmışlar. mertçe doğruyu söyleyin akp'nin islami bir yapısının olmadığını en iyi siz biliyorsunuz. sizin derdiniz nefsinize uymak yalan söylemeyin. #cluvgs,2,,feminist ateist sosyal medya uzmanı la tahzen ile başlayan arapça birşey rte. bir taraf olmayı aşırı huy edinmiş insanlara huy oluyorum [SEP] bazı sosyalist ateist vatandaşlara bakıyorum da hepsi akp yüzünden dinden çıkmışlar. mertçe doğruyu söyleyin akp'nin islami bir yapısının olmadığını en iyi siz biliyorsunuz. sizin derdiniz nefsinize uymak yalan söylemeyin. #cluvgs
küçücük çocuklara böyle şiddet içerikli ideolojik ve dinsel temalı şiirleri metinleri ne hakla okutuyorsunuz? secde etmek kahpe kutsal kitabımız? hristiyan musevi ateist vatandaşı yok mu bu ülkenin?,2,,bazı sosyalist ateist vatandaşlara bakıyorum da hepsi akp yüzünden dinden çıkmışlar. mertçe doğruyu söyleyin akp'nin islami bir yapısının olmadığını en iyi siz biliyorsunuz. sizin derdiniz nefsinize uymak yalan söylemeyin. #cluvgs [SEP] küçücük çocuklara böyle şiddet içerikli ideolojik ve dinsel temalı şiirleri metinleri ne hakla okutuyorsunuz? secde etmek kahpe kutsal kitabımız? hristiyan musevi ateist vatandaşı yok mu bu ülkenin?
sonra insanlar neden deist ya da ateist oluyor,2,,küçücük çocuklara böyle şiddet içerikli ideolojik ve dinsel temalı şiirleri metinleri ne hakla okutuyorsunuz? secde etmek kahpe kutsal kitabımız? hristiyan musevi ateist vatandaşı yok mu bu ülkenin? [SEP] sonra insanlar neden deist ya da ateist oluyor
"şunun gibi 20 30 tane ateist müslüman tartışması izlemişimdir birinde de şöyle bitmiyor ""bak senin körü körüne inandığını ve allah'ın olmadığını bilimle ispat ettim"" aksine şöyle bitiyor ateist ""inanmak istemiyorum ben kardeşim canım istemiyor.""",2,,"sonra insanlar neden deist ya da ateist oluyor [SEP] şunun gibi 20 30 tane ateist müslüman tartışması izlemişimdir birinde de şöyle bitmiyor ""bak senin körü körüne inandığını ve allah'ın olmadığını bilimle ispat ettim"" aksine şöyle bitiyor ateist ""inanmak istemiyorum ben kardeşim canım istemiyor."""
yeni ateist olmuşken muhafazakar sevgili yapmışımdır...,2,,"şunun gibi 20 30 tane ateist müslüman tartışması izlemişimdir birinde de şöyle bitmiyor ""bak senin körü körüne inandığını ve allah'ın olmadığını bilimle ispat ettim"" aksine şöyle bitiyor ateist ""inanmak istemiyorum ben kardeşim canım istemiyor."" [SEP] yeni ateist olmuşken muhafazakar sevgili yapmışımdır..."
çıldırmamak için canlı gs maçı izlemeyeceğime and içerim ateist yeminim,2,,yeni ateist olmuşken muhafazakar sevgili yapmışımdır... [SEP] çıldırmamak için canlı gs maçı izlemeyeceğime and içerim ateist yeminim
israil gerçekten zavallı bir ülke... geleceği yok. israil halkı büyük ölçüde ateist. fuhuş kumar alkol ve uyuşturucu bataklığına saplanmış bir halk...,1,dini,çıldırmamak için canlı gs maçı izlemeyeceğime and içerim ateist yeminim [SEP] israil gerçekten zavallı bir ülke... geleceği yok. israil halkı büyük ölçüde ateist. fuhuş kumar alkol ve uyuşturucu bataklığına saplanmış bir halk...
dört elementten biri olsaydınız ne olurdunuz. hava su toprak ateş ben ateist.,2,,israil gerçekten zavallı bir ülke... geleceği yok. israil halkı büyük ölçüde ateist. fuhuş kumar alkol ve uyuşturucu bataklığına saplanmış bir halk... [SEP] dört elementten biri olsaydınız ne olurdunuz. hava su toprak ateş ben ateist.
"""bunlar kürt değil bunlar müslüman değil bunlar gavur. hdp almış oğlumu götürmüş pkk'nın eline vermiş."" allah'ın izni ile bizi bölmeye çalışan bu kalleşleri senin gibi mübarek analarımızın desteğiyle yok edeceğiz. ağzına yüreğine sağlık mübarek anam... #annelerdireniyor",1,dini,"dört elementten biri olsaydınız ne olurdunuz. hava su toprak ateş ben ateist. [SEP] ""bunlar kürt değil bunlar müslüman değil bunlar gavur. hdp almış oğlumu götürmüş pkk'nın eline vermiş."" allah'ın izni ile bizi bölmeye çalışan bu kalleşleri senin gibi mübarek analarımızın desteğiyle yok edeceğiz. ağzına yüreğine sağlık mübarek anam... #annelerdireniyor"
anadolu'dan şalvarı şaltak osmanlı eğeri kaltak osmanlı ekende yok biçende yok yiyende ortak osmanlı adalardan paşa öşür isterdi köylü da veremezdi asker köye saldırdı her şeyi yağmaladı köylüler birlik oldu paşaya karşı durdu gavur imam vurdukça osmanlı kaçar oldu,2,,"""bunlar kürt değil bunlar müslüman değil bunlar gavur. hdp almış oğlumu götürmüş pkk'nın eline vermiş."" allah'ın izni ile bizi bölmeye çalışan bu kalleşleri senin gibi mübarek analarımızın desteğiyle yok edeceğiz. ağzına yüreğine sağlık mübarek anam... #annelerdireniyor [SEP] anadolu'dan şalvarı şaltak osmanlı eğeri kaltak osmanlı ekende yok biçende yok yiyende ortak osmanlı adalardan paşa öşür isterdi köylü da veremezdi asker köye saldırdı her şeyi yağmaladı köylüler birlik oldu paşaya karşı durdu gavur imam vurdukça osmanlı kaçar oldu"
gavur izmir kurtuluşun kutlu olsun şeref duyuyoruz!...,1,dini,anadolu'dan şalvarı şaltak osmanlı eğeri kaltak osmanlı ekende yok biçende yok yiyende ortak osmanlı adalardan paşa öşür isterdi köylü da veremezdi asker köye saldırdı her şeyi yağmaladı köylüler birlik oldu paşaya karşı durdu gavur imam vurdukça osmanlı kaçar oldu [SEP] gavur izmir kurtuluşun kutlu olsun şeref duyuyoruz!...
norm ender'in gavur izmir dedikten sonra şehrimin atası tektir demesi gibi bir moddayım...,2,,gavur izmir kurtuluşun kutlu olsun şeref duyuyoruz!... [SEP] norm ender'in gavur izmir dedikten sonra şehrimin atası tektir demesi gibi bir moddayım...
#9eylülizmirinkurtuluşu izmir'e gavur diyenler kan testi yaptırmalıdır,2,,norm ender'in gavur izmir dedikten sonra şehrimin atası tektir demesi gibi bir moddayım... [SEP] #9eylülizmirinkurtuluşu izmir'e gavur diyenler kan testi yaptırmalıdır
tr'de olsa kaldırıma motor falan çıkardı kesin gavur memlekete bak çocuklar nasıl rahat koşturuyor,2,,#9eylülizmirinkurtuluşu izmir'e gavur diyenler kan testi yaptırmalıdır [SEP] tr'de olsa kaldırıma motor falan çıkardı kesin gavur memlekete bak çocuklar nasıl rahat koşturuyor
gavur kim?,2,,tr'de olsa kaldırıma motor falan çıkardı kesin gavur memlekete bak çocuklar nasıl rahat koşturuyor [SEP] gavur kim?
koç grubu bak seni mason locaların dahi kurtaramaz. bu ülkede seni parasız gavur topraklarına kendi topraklarına gönderecek hazır daima hazır bir nesil var. bir yerleriniz oynamasın. lakin devlet yine uyuyor gibi yapıyor! #gezifinansörükoçunutmuyoruz,1,dini,gavur kim? [SEP] koç grubu bak seni mason locaların dahi kurtaramaz. bu ülkede seni parasız gavur topraklarına kendi topraklarına gönderecek hazır daima hazır bir nesil var. bir yerleriniz oynamasın. lakin devlet yine uyuyor gibi yapıyor! #gezifinansörükoçunutmuyoruz
kürt müslümana gavur eziyeti !,1,dini,koç grubu bak seni mason locaların dahi kurtaramaz. bu ülkede seni parasız gavur topraklarına kendi topraklarına gönderecek hazır daima hazır bir nesil var. bir yerleriniz oynamasın. lakin devlet yine uyuyor gibi yapıyor! #gezifinansörükoçunutmuyoruz [SEP] kürt müslümana gavur eziyeti !
"birini tanıştırırken alevilerde ""yabancı değil bizden"" sünnilerde ""gavur değil bizden"" yabancılarda ""not animal one of us""",1,dini,"kürt müslümana gavur eziyeti ! [SEP] birini tanıştırırken alevilerde ""yabancı değil bizden"" sünnilerde ""gavur değil bizden"" yabancılarda ""not animal one of us"""
bakınız pkk gavur bir terör örgütüdür fetö gavur bir terör örgütüdür deaş gavur bir terör örgütüdür dhkpc gavur bir terör örgütüdür asala gavur bir terör örgütüydü tüm bu gavurları besleyen devletler de emperyalist devletlerdir #annelerdireniyor,1,dini,"birini tanıştırırken alevilerde ""yabancı değil bizden"" sünnilerde ""gavur değil bizden"" yabancılarda ""not animal one of us"" [SEP] bakınız pkk gavur bir terör örgütüdür fetö gavur bir terör örgütüdür deaş gavur bir terör örgütüdür dhkpc gavur bir terör örgütüdür asala gavur bir terör örgütüydü tüm bu gavurları besleyen devletler de emperyalist devletlerdir #annelerdireniyor"
